ID,Name,Disciplines,when_added
37e63935-be43-4a88-8f83-97da12647a08,Department of Plant Biotechnology and Bioinformatics,"['020701', '010610', '010603']",1
bb29afde-b1cb-45eb-8ec6-5c3157603644,Department of Neurosciences,"['030123', '030623']",1
ae0fd542-8bb0-4e90-93fa-47d48ca37e41,"Department of Mathematical Modelling, Statistics and Bio-informatics",['010603'],1
67f1fec9-585d-4d12-a178-8bc285cc8593,Leuven Centre for Global Governance Studies,['059999'],1
60b45899-960b-4b3a-9abf-e795124ac8b5,Dean's Office of the Faculty of Medicine and Health Sciences,[],1
5f4ab818-63ad-42cf-98b1-ec9da03776a5,Department of Pediatrics and medical genetics,['030129'],1
34e6df10-3289-476d-9c7a-f9cd2417f4ae,Department of Molecular biotechnology,"['040104', '020701', '010608', '030120']",1
f8a2c131-1e07-40cf-af96-caa670c0b1c8,Nuclear Medicine & Molecular Imaging,"['030118', '030618', '030504']",1
