ID,Name,Disciplines,WoS ID,Disciplines WoS,vabb ID,Disciplines vabb,Persons,Size,Alias,when_added
feeba12a-b566-4932-8ef6-df93943b684b,Long-term Oscillator Stability,[],['000364510600006'],[],[],[],"['3f966f43-085b-4081-8bbf-e0fb7631a56d', 'dbf87248-14ca-485f-a513-cdcb850f334a', '8a818f6a-be91-4c27-bdc3-164d4de8d025']",3,[],1
e6db7fad-0f34-4dd9-af2e-d6b01dae3c82,Fractional order impedance models as rising tools for quantification of unconscious analgesia,[],['000333245100034'],[],[],[],"['0496a59e-7990-494c-8d19-fa78cc900501', 'ad372efe-c342-406e-85da-aaa651d3edf4', '5b420256-82a4-44da-b7bd-e3ad53a5450c', 'b727e461-0720-421f-a47e-f8964e27b66d']",9,[],1
7c3ae581-c9fd-4b41-bbfb-b23e0d104df9,HIL real-time simulation of a digital fractional order PI controller for time delay processes,[],['000352082700204'],[],[],[],['5b420256-82a4-44da-b7bd-e3ad53a5450c'],5,[],1
32b90465-e662-4c54-95e6-3c5d70356102,Design and testing of an orthoplanar micro-valve,[],['000253310600007'],[],[],[],"['ecf400bd-b757-4a60-a324-366bcce73153', '3de3d3eb-d3ff-4a5d-94f8-61f55e13cc4b', '80316be9-5fa9-49dc-8440-dea5a05eeaed', '3f83116c-4ee6-4c79-984d-25b5e953cd3d']",8,[],1
3aeebcd6-9a32-4e50-9017-78c6ba0a95e0,Fractional-order modeling of impedance measurements in a blood-resembling experimental setup,[],['000521353900144'],[],[],[],"['d967aea2-86dc-4476-8036-9c090853ee93', 'ad372efe-c342-406e-85da-aaa651d3edf4', '605f65de-91eb-4938-aa6f-d585ad38d8fe', '5b420256-82a4-44da-b7bd-e3ad53a5450c']",5,[],1
60706432-9d37-407c-82e7-6989cc998b8d,ERROR,ERROR,ERROR,ERROR,ERROR,ERROR,ERROR,ERROR,ERROR,1
7d99ce76-60e4-463b-aaaf-b6fb83759efe,Grasping execution and grasping observation activity of single neurons in the macaque anterior intraparietal area,"['0501', '0501', '0306']",['000341572600014'],"['0501', '0501']",['c:vabb:406806'],['0306'],"['40c0a2e7-a74f-4f1e-b08b-4fd7f703b659', '4642dbd0-7952-46b3-8a98-daef93c3845c', '5be4f4a9-8e23-4b68-b065-b72cf2d797c2']",4,[],1
9d866b97-5500-4c11-9706-f2fb3156babe,Patterned growth of metal-organic framework coatings by electrochemical synthesis,"['0104', '0104']",['000268138200007'],"['0104', '0104']",[],[],"['59416db9-5d0c-463d-a025-871b1d1be1f1', 'b5079f1c-c89d-401c-9965-8b51b8a44601', '2bb65232-5b56-4c32-a160-508c3786406a', '0b105cd8-0970-4a20-a83e-213948fa9d5c', '9ceb2001-cc74-4964-8ad3-c04cd890e1ff', '1979eabb-80ab-4273-a84e-9066c8c81fac']",6,[],1
685ffa0f-521c-4941-8b0a-b5595162c4e2,Impact of disturbance filter in nonlinear EPSAC predictive control of blood glucose level in type I diabetic patients,[],['000263577800099'],[],[],[],"['5b420256-82a4-44da-b7bd-e3ad53a5450c', 'b727e461-0720-421f-a47e-f8964e27b66d']",3,[],1
67a75522-39e9-4e60-99f8-11263946b31a,Si-based tunnel field-effect transistors for low-power nano-electronics,[],[],[],[],[],"['38b83004-d0b5-4de0-b612-c9e94bbcd9c2', '3ced910f-e6c9-44fa-be29-1c1191eed800', 'f62ed979-f3f4-4ed0-9a9c-0e5c310c3469', 'd52f509e-625a-4dd6-98ed-2e503cd66441', '1fbefe72-afa4-4d9d-bce3-ecf06cb5701c', '8a818f6a-be91-4c27-bdc3-164d4de8d025', '44e79ea1-ec61-4754-a083-b10ad7f15f0e', 'a275bbb8-47ce-4129-99a0-19bc88a69993']",18,[],1
294cbd08-238d-49a7-976a-b957f6723af6,MAGNETIC MICROPARTICLE BASED DNA EXTRACTION  IN A DROPLET MICROFLUIDIC CHIP,[],[],[],[],[],"['903b095b-1c1f-4256-af14-2b9d9b53910b', '025af035-0141-49b9-b503-96f58c8761c6', 'ecf400bd-b757-4a60-a324-366bcce73153', 'ae3be79d-1cd3-486b-9a2c-2b10dbac77e8', 'c62c10dd-df31-4c49-9a17-d801cd6a7ead', '3de3d3eb-d3ff-4a5d-94f8-61f55e13cc4b']",8,[],1
8d078335-0db1-4dfb-86e7-e12098e337c1,Teaching HW/SW Co-Design With a Public Key Cryptography Application,"['0202', '0508']",['000326651700015'],"['0202', '0508']",[],[],"['177989e2-fde3-4ed6-b23b-64758e178199', '5a577124-914f-48ef-aeef-bdd384258489', 'e038fff7-aa45-47f8-bdc8-4a4b7ced673a', '958fec3b-5742-43a9-b42e-5569ea0127e0', '646f6bd9-9986-45cc-9462-98160578eb9e', '0a65fd6b-224e-4ec0-9e4e-7d65b329d425', '8a818f6a-be91-4c27-bdc3-164d4de8d025']",7,[],1
adb1f47b-d6f6-4c2a-adcb-6405d33413da,Fractional order control for the temperature loop in a chemical reactor,[],[],[],[],[],['5b420256-82a4-44da-b7bd-e3ad53a5450c'],4,[],1
0b99c92a-aa8a-4e7e-b2e5-e6530dfb9fa5,Robust predictive control design for optimal wet-clutch engagement,[],['000310776204143'],[],[],[],"['b727e461-0720-421f-a47e-f8964e27b66d', '5b420256-82a4-44da-b7bd-e3ad53a5450c']",6,['817ca3be-9c7c-43fb-a900-ce4bfbb29622'],1
2b0b7901-663b-4e69-a5e4-24d253d85ad6,Gel-Based Morphological Design of Zirconium Metal-organic Frameworks,['/'],['000400553000077'],['/'],[],[],"['a8890840-e6be-4b7b-ab75-79b1692fa1ff', 'fe012502-1382-4c84-8d00-b8d801158f86', '741b5a21-5904-4b29-a627-50c7249dd776', 'd136cb03-c12d-41fb-89a8-90b00025cbb0', '59416db9-5d0c-463d-a025-871b1d1be1f1', '1979eabb-80ab-4273-a84e-9066c8c81fac']",12,"['936c9fbc-fc5f-4607-bba1-ef7e4bee0b66', '1fb6f61f-0881-436b-94e9-9a687802d08f']",1
3b93f943-e9aa-44fd-95f6-0e0fda0af5f9,4D synchrotron microtomography and pore-network modelling for directin situcapillary flow visualization in 3D printed microfluidic channels,[],['000545864300012'],[],[],[],"['5abb72c3-97d4-45fd-a6ae-ec008dfd8c7e', 'dadd7d39-8c60-4488-a875-14e3f5b77d42', 'bcc46b8c-d40a-48f2-8163-1f8ad8ca962b', 'c0ee7708-4b2d-4295-900a-3c8ca8ea0464', '59416db9-5d0c-463d-a025-871b1d1be1f1', '06640bab-08b1-471d-98f7-60a6f4d40012']",9,[],1
abc40e75-b0cb-4e15-852d-e0ab1e483fb8,An approach towards multivariable control of anaerobic digestion using the EPSAC predictive control strategy,[],[],[],[],[],"['ad372efe-c342-406e-85da-aaa651d3edf4', '5b420256-82a4-44da-b7bd-e3ad53a5450c', '4614fda3-7a5c-4cc8-9658-a41283151805', 'b727e461-0720-421f-a47e-f8964e27b66d']",5,[],1
78d4a470-fbac-4ca6-938f-56d8945745b5,Fractional order modeling of diffusion processes : a new approach for glucose concentration estimation,[],['000390997900067'],[],[],[],"['ad372efe-c342-406e-85da-aaa651d3edf4', 'b727e461-0720-421f-a47e-f8964e27b66d', '5b420256-82a4-44da-b7bd-e3ad53a5450c']",4,[],1
ff3dc7bf-45e1-4745-91b2-b4ffa14765fe,Accounting for variability in the design of circuits with organic thin-film transistors,"['0104', '0103', '0103']",['000333097300014'],"['0104', '0103', '0103']",[],[],"['97acd216-4bca-4f77-8404-bbd849f276cf', 'f0c3f9c7-d78c-4c90-b9cc-f08c5f4c00a4', '8a818f6a-be91-4c27-bdc3-164d4de8d025', 'cd55b156-a6d8-4030-9ca0-5787f43728cd']",5,[],1
fdc237c7-5535-4ce5-be9e-a1693a0ce7ee,Evaluatiekeuze en –praktijken bij iSTEM,[],[],[],[],[],"['4e46dd2a-7dfe-4207-82ba-c042fb199f8f', '2d06919f-7d25-411a-8bf2-8f53bee1341c', '8a818f6a-be91-4c27-bdc3-164d4de8d025']",4,[],1
dc2684f0-a99e-4c3c-af05-cb6ae280abe0,Unipolar Organic Transistor Circuits Made Robust by Dual-Gate Technology,['0202'],['000289908700020'],['0202'],[],[],"['97acd216-4bca-4f77-8404-bbd849f276cf', 'f0c3f9c7-d78c-4c90-b9cc-f08c5f4c00a4', '8a818f6a-be91-4c27-bdc3-164d4de8d025', 'cd55b156-a6d8-4030-9ca0-5787f43728cd']",7,[],1
d0393d9c-1d69-4acb-9f98-e2879658c6f7,ERROR,ERROR,ERROR,ERROR,ERROR,ERROR,ERROR,ERROR,ERROR,1
152d76ed-4f8b-4026-8f66-88c5bfd6024e,A 128∶2048/1536 point FFT hardware implementation with output pruning,[],['000393420200054'],[],[],[],"['552c087f-5c88-4b7b-a2e4-63d7ac370ff9', '8a818f6a-be91-4c27-bdc3-164d4de8d025', '2a86037c-279b-4632-acf1-fcf1561c1b59']",3,[],1
d55ba8c2-8096-441a-a662-67289e783c38,Drug interaction between propofol and remifentanil in individualised drug delivery systems,[],[],[],[],[],"['ad372efe-c342-406e-85da-aaa651d3edf4', 'b727e461-0720-421f-a47e-f8964e27b66d', '5b420256-82a4-44da-b7bd-e3ad53a5450c']",3,[],1
0a15cea7-8c42-4e58-b85a-17d999eabd74,A Novel Method for Monolithic Fabrication of Polymer Microneedles on a Platform for Transdermal Drug Delivery,[],['000341702100038'],[],[],[],"['f100fd78-6756-4359-b1a0-867ddd2307f0', 'ecf400bd-b757-4a60-a324-366bcce73153', '9866188c-b023-4d4c-a5da-f21be6d8cb89', '3de3d3eb-d3ff-4a5d-94f8-61f55e13cc4b']",4,[],1
63f99428-1f36-4dc1-926f-67de29e45c46,ERROR,ERROR,ERROR,ERROR,ERROR,ERROR,ERROR,ERROR,ERROR,1
f75ce071-8a6d-4758-965a-16bf80b8ee58,"Creationism in Europe: facts, gaps and prospects",['0603'],['000330208200007'],['0603'],['c:vabb:352216'],[],['dc6635a5-56db-498e-8818-58a5d70c4016'],4,[],1
8ba1100e-40c2-4292-8389-7c6d3c477d29,An 8b organic microprocessor on plastic foil,[],[],[],[],[],"['97acd216-4bca-4f77-8404-bbd849f276cf', 'f0c3f9c7-d78c-4c90-b9cc-f08c5f4c00a4', '8a818f6a-be91-4c27-bdc3-164d4de8d025', 'cd55b156-a6d8-4030-9ca0-5787f43728cd']",6,[],1
2b5e0ff1-7f76-4ed5-a3d7-5967ddc4eab9,Model development for Propofol and Remifentamil management during ICU anesthesia,[],['000392907300020'],[],[],[],"['d2bea842-b31c-438a-aa2e-525cf6e43afe', '5b420256-82a4-44da-b7bd-e3ad53a5450c', 'b727e461-0720-421f-a47e-f8964e27b66d']",4,['ea18325e-2a6e-49b2-834e-d29a2504dca6'],1
d3929d34-5406-4f4d-8112-0fca3239e339,The role of binocular disparity in stereoscopic images of objects in the macaque Anterior Intraparietal area,['0106'],['000315157200024'],['0106'],[],[],"['4642dbd0-7952-46b3-8a98-daef93c3845c', 'c4773c88-e4ea-4e01-a6d2-05a67d4d480f', '5be4f4a9-8e23-4b68-b065-b72cf2d797c2']",4,[],1
778a0769-89a2-4d4d-b341-ec606bccfb0a,Cross-Layer Optimization for Power-Efficient and Robust Digital Circuits and Systems,[],[],[],[],[],"['f9f984bb-b8a3-4bc3-acc0-a2a83209a44b', '8a818f6a-be91-4c27-bdc3-164d4de8d025', 'ab12b556-ebc6-4f9a-bdc6-e1c485b14de0']",3,[],1
3ac9fa46-3840-46ea-95e4-140f4c054bf8,A one-step procedure for frequency response estimation based on a switch-mode transfer function analyser,[],['000303506201127'],[],[],[],"['b727e461-0720-421f-a47e-f8964e27b66d', '5b420256-82a4-44da-b7bd-e3ad53a5450c']",3,[],1
eb0c34d0-c8a5-4407-a7f8-e31e64c9f121,Human thoughts and actions between gloom and confidence,[],[],[],[],[],['dc6635a5-56db-498e-8818-58a5d70c4016'],4,[],1
2e33540b-ac42-4210-bb58-025d194570dd,ERROR,ERROR,ERROR,ERROR,ERROR,ERROR,ERROR,ERROR,ERROR,1
abc40e75-b0cb-4e15-852d-e0ab1e483fb8,An approach towards multivariable control of anaerobic digestion using the EPSAC predictive control strategy,[],[],[],[],[],"['ad372efe-c342-406e-85da-aaa651d3edf4', '5b420256-82a4-44da-b7bd-e3ad53a5450c', '4614fda3-7a5c-4cc8-9658-a41283151805', 'b727e461-0720-421f-a47e-f8964e27b66d']",5,[],1
48ce7921-4d75-4a0d-9e9b-300bf02e3fc4,EPSAC predictive control applied to muscle relaxant administration,[],[],[],[],[],"['d2bea842-b31c-438a-aa2e-525cf6e43afe', 'b727e461-0720-421f-a47e-f8964e27b66d', '5b420256-82a4-44da-b7bd-e3ad53a5450c']",4,[],1
c6256241-5481-4443-b5f0-4ef1fcf39b70,Whence pseudoscience? An epidemiological approach,['060104'],[],[],['c:vabb:469191'],['060104'],"['b2708d1b-b295-4bb6-8157-643af8d506f5', 'dc6635a5-56db-498e-8818-58a5d70c4016']",4,[],1
ad1e48b4-994d-4e10-ad4d-4803a2be1a1d,A comparative study of three relay-based PID auto-tuners,[],[],[],[],[],"['b727e461-0720-421f-a47e-f8964e27b66d', '5b420256-82a4-44da-b7bd-e3ad53a5450c']",2,[],1
13e2bbdb-7b64-4d02-9c7d-daebed4b1287,ERROR,ERROR,ERROR,ERROR,ERROR,ERROR,ERROR,ERROR,ERROR,1
a8ad037a-be7b-47eb-9660-e4fa29cdbb74,Interfacial synthesis of hollow MOF capsules demonstrating selective permeability,[],[],[],[],[],"['59416db9-5d0c-463d-a025-871b1d1be1f1', '23a9eb21-3d22-419e-a005-193572d08ad1', '6d4c1ebd-139a-4917-bcea-76a7f3002aaf', '9ceb2001-cc74-4964-8ad3-c04cd890e1ff']",6,[],1
1ca15b9d-6133-4bc4-a39e-d33a5076cee3,Improving performance for a 13C isotope separation plant using multivariable fractional order controllers,[],[],[],[],[],['5b420256-82a4-44da-b7bd-e3ad53a5450c'],5,[],1
fe75ce4f-a7c3-411a-8fb8-790328f12f0e,Dealing with creationist challenges: what European biology teachers might expect in the classroom,"['0106', '0508', '0503']",['000300145600002'],"['0106', '0508']",['c:vabb:319628'],['0503'],"['b2708d1b-b295-4bb6-8157-643af8d506f5', 'dc6635a5-56db-498e-8818-58a5d70c4016']",6,['f757aabe-5bbc-4f29-af0a-bced1063fbb2'],1
212e79d5-9eaa-4ea1-b539-97e3031ade53,"A Novel, PLL-based frequency-to-digital conversion mechanism for sensor interfaces","['0202', '0103']",['000298465100034'],"['0202', '0103']",[],[],"['31e4378d-ba26-489d-aeb3-3567840ad7ad', '3f966f43-085b-4081-8bbf-e0fb7631a56d', '8a818f6a-be91-4c27-bdc3-164d4de8d025', 'dbf87248-14ca-485f-a513-cdcb850f334a']",5,[],1
069a7fc6-d740-4cf7-9a8f-2d9e33ecc7fd,Influence of a Nonlinear Amplifier,[],['000364510600016'],[],[],[],"['3f966f43-085b-4081-8bbf-e0fb7631a56d', 'dbf87248-14ca-485f-a513-cdcb850f334a', '8a818f6a-be91-4c27-bdc3-164d4de8d025']",3,[],1
8a101d56-e9ac-478e-a39c-02886491feaa,A 60GHz transmitter in 40nm CMOS achieving mm-precision for discrete-carrier localization,[],['000349461900067'],[],[],[],"['f3d5f569-7f38-40b0-87fd-4c10001a6f0e', '552c087f-5c88-4b7b-a2e4-63d7ac370ff9', '2a86037c-279b-4632-acf1-fcf1561c1b59', '8a818f6a-be91-4c27-bdc3-164d4de8d025', '3f2f2060-1d9b-42c8-ad64-a94db5598223']",8,[],1
652c5c2f-f050-4ec2-8b9a-d75fafc1b724,Interpreting the history of evolutionary biology through a Kuhnian prism : sense or nonsense?,[],[],[],[],[],"['316c60ba-c0bd-4b73-8f1e-f204a5e14bc5', '0c8f4392-19d0-4833-85e8-b5066405d9c1', '2d521553-0152-4c18-a953-9335b6a1d4f4', 'dc6635a5-56db-498e-8818-58a5d70c4016']",4,[],1
27824c3c-5b7e-4709-9bcc-da3adb1247c1,A constrained EPSAC approach to inventory control for a benchmark supply chain system,"['0299', '0303']",['000368039100015'],"['0299', '0303']",[],[],"['5b420256-82a4-44da-b7bd-e3ad53a5450c', '88819246-9160-415f-aa25-f415cb934cca', 'b727e461-0720-421f-a47e-f8964e27b66d']",4,['bdf28a47-81f2-4611-b2d1-a1942c374ad4'],1
42af12ba-98f1-47bb-8d98-f9342176682b,Model development for Propofol and Remifentanil induced anesthesia in ICU patient,[],[],[],[],[],"['d2bea842-b31c-438a-aa2e-525cf6e43afe', '5b420256-82a4-44da-b7bd-e3ad53a5450c', 'b727e461-0720-421f-a47e-f8964e27b66d']",4,[],1
70d3aee4-982b-4445-92ec-6618bd6c6b60,A comparative study between spiral-filter press and belt press implemented in a cloudy apple juice production process,"['0401', '0104', '0304']",['000347755800129'],"['0401', '0104', '0304']",[],[],"['4e216c9f-c254-48ed-a5ab-78ddd8dfff58', '3474dfc8-5d66-43c4-b6a4-0fa8a1fcdf18']",9,"['40eaffec-d173-4655-b231-aa62452a44ce', '434b7feb-e261-4abb-b4ff-98b4dcfcbeae']",1
660698ba-dba9-46d4-b7d5-a046b800683c,Evaluation of an internal model control extension for efficient disturbance rejection,[],[],[],[],[],"['b727e461-0720-421f-a47e-f8964e27b66d', '5b420256-82a4-44da-b7bd-e3ad53a5450c']",3,[],1
0b1608af-6e7d-4a49-ac10-99d8c1833b97,ERROR,ERROR,ERROR,ERROR,ERROR,ERROR,ERROR,ERROR,ERROR,1
45360e1b-6c58-47db-9575-944088631758,Virginie Loveling (1836-1923) as a cultural mediator: from translating Klaus Groth to manipulating Charles Darwin,[],[],[],['c:vabb:280300'],[],"['3cd22fb2-747b-4940-9e99-f322cda4beee', '31706b13-12de-493c-8383-f094ece6ef01', 'dc6635a5-56db-498e-8818-58a5d70c4016']",5,[],1
d04196c7-7afd-474a-a192-69e07fb5df79,A Subsampling Pulsed UWB Demodulator Based on a Flexible Complex SVD,[],['000260566200020'],[],[],[],"['f0f9ce45-198f-4a5e-b9f4-849891ed668d', '8a818f6a-be91-4c27-bdc3-164d4de8d025']",2,[],1
d97e4a77-34fc-4513-95f6-3af4e29c9b0d,Model-based vs auto-tuning design of PID controller for knee flexion during gait,[],['000370963704001'],[],[],[],"['0496a59e-7990-494c-8d19-fa78cc900501', '5b420256-82a4-44da-b7bd-e3ad53a5450c', 'b727e461-0720-421f-a47e-f8964e27b66d']",3,['00708649-f0e4-4457-a8a5-f445f5a31b5c'],1
7ee52aee-6484-4d1b-93a1-6321aa0aa3eb,Correlations between fractional-order model parameters and the effect of geometrical changes in human respiratory airways,[],[],[],[],[],"['5b420256-82a4-44da-b7bd-e3ad53a5450c', 'b727e461-0720-421f-a47e-f8964e27b66d']",2,[],1
b1515c15-3fe9-42e2-82da-ad62ba1e88f6,Development of an Open-Source Smart Energy House for K-12 Education,[],['000331874303049'],[],[],[],"['307cd83b-afa2-4a49-838b-e280a7b8a877', '4c1117bf-66bf-401c-94e7-f646e9f505b6', 'd4222f31-6ade-4ef4-8462-11575729a9b2', '609e8a90-a2bf-42b9-8e61-3c7c92fd38c4', '40b6260d-b7b6-499b-ba1a-9992d093a4c6', 'a16a7d29-5d4b-47cc-8b47-3ff13d4afe1a', '3f966f43-085b-4081-8bbf-e0fb7631a56d', '7464b2ac-3ff2-4221-bb2b-c8ae383301f9', 'a7c4b54c-a880-4488-90fb-adf1be975d93', '23ada668-84b6-41ac-b713-965cf012f6ee', 'd686a2af-49e7-4e96-9c40-abff28105ece', 'dbf87248-14ca-485f-a513-cdcb850f334a', '3de3d3eb-d3ff-4a5d-94f8-61f55e13cc4b', '7e030a55-9c17-4966-8d80-f3e152366f6e', '4742a7c7-4735-4e68-9050-a3229fcd4894', '457efd1d-a6ae-4d5e-9eb0-a031200f4e08', '8a818f6a-be91-4c27-bdc3-164d4de8d025', '204c07d5-fe81-41f1-88de-d2c9d7c5ef1d']",18,[],1
5bbbe8d7-8c9c-4e3a-a0d8-667e9e6d9992,Advantage of low-cost predictive control : study case on a train of distillation columns,['0104'],['000452200900006'],['0104'],[],[],['5b420256-82a4-44da-b7bd-e3ad53a5450c'],5,[],1
bc9c8624-9c7b-459d-afb6-6493c6c9ec83,Choice-related activity in the anterior intraparietal area during three-dimensional-structure categorization,"['0501', '0501', '0306']",['000354111600003'],"['0501', '0501']",['c:vabb:407182'],['0306'],"['5ecdb532-de54-4307-afe4-680ab0c60770', '2acef3aa-e70e-4d37-bee1-eaf5c521c4e2', '7f8b8f08-e99b-4e17-83f1-5b5d60791a53', '5be4f4a9-8e23-4b68-b065-b72cf2d797c2']",4,[],1
432d5d92-95b0-401e-8817-ad2b3b68a280,ERROR,ERROR,ERROR,ERROR,ERROR,ERROR,ERROR,ERROR,ERROR,1
294cbd08-238d-49a7-976a-b957f6723af6,MAGNETIC MICROPARTICLE BASED DNA EXTRACTION  IN A DROPLET MICROFLUIDIC CHIP,[],[],[],[],[],"['903b095b-1c1f-4256-af14-2b9d9b53910b', '025af035-0141-49b9-b503-96f58c8761c6', 'ecf400bd-b757-4a60-a324-366bcce73153', 'ae3be79d-1cd3-486b-9a2c-2b10dbac77e8', 'c62c10dd-df31-4c49-9a17-d801cd6a7ead', '3de3d3eb-d3ff-4a5d-94f8-61f55e13cc4b']",8,[],1
5bac7f2e-2d8b-4365-82f8-fb69ae05c491,ERROR,ERROR,ERROR,ERROR,ERROR,ERROR,ERROR,ERROR,ERROR,1
a5dfe36b-5f8e-4272-a1d4-ae7fca4225bd,Detecting and analyzing non-linear effects in respiratory impedance measurements,[],['000295376006072'],[],[],[],"['5b420256-82a4-44da-b7bd-e3ad53a5450c', 'b727e461-0720-421f-a47e-f8964e27b66d']",3,[],1
2f165fb0-a3af-4435-bb3a-5994769fff4a,Nimrad: novel technique for respiratory data treatment,"['0202', '0103']",['000344621800011'],"['0202', '0103']",[],[],['5b420256-82a4-44da-b7bd-e3ad53a5450c'],3,[],1
87486125-3a01-4729-a24f-dcdf5be2c620,Distributed model predictive control of steam/water loop in large scale ships,['0104'],['000478663200003'],['0104'],[],[],"['51a8a5e3-38e3-4e76-9622-c76905858c09', '73087af1-936d-407c-9320-875db36d554b', 'b727e461-0720-421f-a47e-f8964e27b66d', '5b420256-82a4-44da-b7bd-e3ad53a5450c']",5,[],1
1b232b00-3aa3-4350-b479-210afc0c878e,A novel fractional-order model and controller for vibration suppression in flexible smart beam,"['0299', '0103']",['000435692500021'],"['0299', '0103']",[],[],['5b420256-82a4-44da-b7bd-e3ad53a5450c'],4,[],1
a5dfe36b-5f8e-4272-a1d4-ae7fca4225bd,Detecting and analyzing non-linear effects in respiratory impedance measurements,[],['000295376006072'],[],[],[],"['5b420256-82a4-44da-b7bd-e3ad53a5450c', 'b727e461-0720-421f-a47e-f8964e27b66d']",3,[],1
865f1ea0-b134-48a0-980f-ae5e87f9a478,Interfacial synthesis of hollow MOF capsules demonstrating selective permeability,['/'],['000289712600012'],['/'],[],[],"['59416db9-5d0c-463d-a025-871b1d1be1f1', '23a9eb21-3d22-419e-a005-193572d08ad1', '6d4c1ebd-139a-4917-bcea-76a7f3002aaf', '9ceb2001-cc74-4964-8ad3-c04cd890e1ff', '1979eabb-80ab-4273-a84e-9066c8c81fac']",6,[],1
de86fa86-e68e-4b39-b7c8-aac0c1f52122,Memristor-based data memory architecture in ASIP design,[],['000337235200108'],[],[],[],"['b8616074-f95f-4a9c-b31f-48c45030eef6', 'ab12b556-ebc6-4f9a-bdc6-e1c485b14de0', '8a818f6a-be91-4c27-bdc3-164d4de8d025', 'bd4aa520-f123-47f5-87c3-6d5103976582']",7,[],1
467d9987-81d4-4b8b-858b-e77330e0c593,A simplified model to characterize drug effect in the body,[],[],[],[],[],['5b420256-82a4-44da-b7bd-e3ad53a5450c'],1,[],1
b53b44ad-1e92-46ce-85cf-56b6ec0bb661,Measurement Issues for Jitter and Phase Noise,[],['000364510600017'],[],[],[],"['3f966f43-085b-4081-8bbf-e0fb7631a56d', 'dbf87248-14ca-485f-a513-cdcb850f334a', '8a818f6a-be91-4c27-bdc3-164d4de8d025']",3,[],1
304d9882-da75-40db-b1e5-7a57e55b609f,"New measurement system for inline basis weight monitoring: Clean millimeter, wave-based system targeting synthetic nonwovens showing market potential",[],[],[],[],[],"['8a818f6a-be91-4c27-bdc3-164d4de8d025', '3f2f2060-1d9b-42c8-ad64-a94db5598223']",6,[],1
1fe97c88-6246-4a33-bb92-f9cadc9438f2,Laboratory-scale membrane up-concentration and co-anaerobic digestion for energy recovery from sewage and kitchen waste,"['0207', '0299']",['000374396300018'],"['0207', '0299']",[],[],['3474dfc8-5d66-43c4-b6a4-0fa8a1fcdf18'],8,[],1
9a00a57f-c88a-4ca1-9376-92f9d2a1786f,Passive samplers for monitoring VOCs in groundwater,[],[],[],[],[],"['3474dfc8-5d66-43c4-b6a4-0fa8a1fcdf18', 'f06ccae9-ff40-4c2a-86f6-43d7c95e4178']",4,[],1
a1cdd548-7802-48e8-a249-4c91b038628c,ERROR,ERROR,ERROR,ERROR,ERROR,ERROR,ERROR,ERROR,ERROR,1
d20173a6-bc81-4bdb-aa13-35ea5905109e,ERROR,ERROR,ERROR,ERROR,ERROR,ERROR,ERROR,ERROR,ERROR,1
79ed9713-db36-4a00-b3cb-ab011b26948a,"Actuators: Accomplishments, opportunities and challenges","['0202', '0103']",['000483635900066'],"['0202', '0103']",[],[],"['ecf400bd-b757-4a60-a324-366bcce73153', '3de3d3eb-d3ff-4a5d-94f8-61f55e13cc4b']",4,[],1
31d8249c-49d6-4bb3-bf5a-efc2515b19fa,Relations between fractional-order model parameters and lung pathology in chronic obstructive pulmonary disease,['0306'],['000265937200007'],['0306'],[],[],"['5b420256-82a4-44da-b7bd-e3ad53a5450c', 'b727e461-0720-421f-a47e-f8964e27b66d']",2,['a01cf05b-36a5-40b1-894d-950e1873de7c'],1
146dc2ab-8b4e-4561-930a-3f6ab1b58b7e,Impact of Interconnect Multiple-Patterning Variability on SRAMs,[],[],[],[],[],"['91a4d733-79a5-4fec-af25-11dc66ed5b86', '8a818f6a-be91-4c27-bdc3-164d4de8d025']",9,[],1
86babd12-3df2-410b-a6b4-4424cdc1dbfb,Through-Silicon-Via Capacitance Reduction Technique to Benefit 3-D IC Performance,['0202'],['000284097800001'],['0202'],[],[],"['1fbefe72-afa4-4d9d-bce3-ecf06cb5701c', '8a818f6a-be91-4c27-bdc3-164d4de8d025']",5,[],1
3101dcc9-4dfb-4cd6-b69e-b052d54b89a1,A distributed model predictive control strategy for the bullwhip reducing inventory management policy,"['0501', '0202', '0299']",['000458199000029'],"['0501', '0202', '0299']",[],[],"['5b420256-82a4-44da-b7bd-e3ad53a5450c', 'b727e461-0720-421f-a47e-f8964e27b66d']",6,['4f922ca8-0f1a-404e-bef4-f814e0ec415a'],1
aaa36672-ba20-497f-868b-f67853ddcfa5,Fractional order PDμ control of a visual servoing manipulator system,[],['000332509704070'],[],[],[],"['5b420256-82a4-44da-b7bd-e3ad53a5450c', 'b727e461-0720-421f-a47e-f8964e27b66d']",4,"['6cce1b47-ea62-4818-9c68-c89309386a3c', 'd5e3b345-bbc2-4805-9a3b-23113cf699e3']",1
e4f78349-da7e-439f-809e-f3e7901d8963,Adaptive EPSAC predictive control of the hypnotic component in anesthesia,[],['000400227100018'],[],[],[],"['5b420256-82a4-44da-b7bd-e3ad53a5450c', 'b727e461-0720-421f-a47e-f8964e27b66d']",4,[],1
60282276-bea6-4c3c-a9fb-ab6036c87007,Design and analysis of a multivariable fractional order controller for a non-minimum phase system,"['0299', '0103']",['000376679000005'],"['0299', '0103']",[],[],"['b727e461-0720-421f-a47e-f8964e27b66d', '5b420256-82a4-44da-b7bd-e3ad53a5450c']",5,['46ce82b1-834a-4d9e-840b-ff7c6249d1a9'],1
f5b8b79a-f73d-4693-8558-4454eacdbd92,Integrated STEM education: A systematic review of instructional practices in secondary education,[],[],[],['c:vabb:451742'],[],"['56d11ce4-21ec-4b03-9584-9c1c09f8e525', '293d0e08-4897-40d0-9ba8-1b493eb88230', '0171d5b7-3f9b-4986-a8b5-a53a08ae5a11', '4e46dd2a-7dfe-4207-82ba-c042fb199f8f', '8a818f6a-be91-4c27-bdc3-164d4de8d025', '472e0c14-a2f7-4195-9c5b-67ff89f784cc', '2d06919f-7d25-411a-8bf2-8f53bee1341c', '65ccccad-955a-453d-8f39-b09a32e62212', 'fcfada9f-eafe-4ef5-8ada-2d0ed064ec44', '00d708af-f70c-4532-887c-9e956b7a7de3']",17,"['8f91ef9f-64e4-479c-8e1f-59a95b7e44bf', 'ca1698a7-95cc-494b-9b8c-5b1dabe5a13a']",1
880b9e35-ba58-4a4e-9af3-ae4569ed5958,Thermal degradation of cloudy apple juice phenolic constituents,"['0401', '0104', '0304']",['000337853000026'],"['0401', '0104', '0304']",[],[],"['4e216c9f-c254-48ed-a5ab-78ddd8dfff58', '3474dfc8-5d66-43c4-b6a4-0fa8a1fcdf18']",9,"['85a863ab-6bcf-4d59-9302-68421f7290dc', '0f9429ae-4a65-4956-8457-fc1e3a7fb3a6']",1
d000887b-3f0f-4594-a8dd-501c3b904e88,"Fabrication process for tall, sharp, hollow, high aspect ratio polymer microneedles on a platform","['0104', '0202', '0299', '0103', '0103']",['000321063300032'],"['0104', '0202', '0299', '0103', '0103']",[],[],"['ecf400bd-b757-4a60-a324-366bcce73153', '9866188c-b023-4d4c-a5da-f21be6d8cb89', '3de3d3eb-d3ff-4a5d-94f8-61f55e13cc4b']",4,[],1
4b7eca58-b00d-424a-8339-4fd6fadbdddd,A novel auto-tuning method for fractional order PI/PD controllers,"['0202', '0299', '0103']",['000378187500028'],"['0202', '0299', '0103']",[],[],"['b727e461-0720-421f-a47e-f8964e27b66d', '5b420256-82a4-44da-b7bd-e3ad53a5450c']",3,['39469438-74bb-4c70-9c85-66854d5caeef'],1
dd9c907c-4971-4ee5-9d7d-fe08c4433a7c,Electronic Effects of Linker Substitution on Lewis Acid Catalysis with Metal-Organic Frameworks,['/'],['000303925200019'],['/'],[],[],"['23a9eb21-3d22-419e-a005-193572d08ad1', '13b330d1-ab5c-43e6-90ee-b4a30a93fb55', '59416db9-5d0c-463d-a025-871b1d1be1f1', '1979eabb-80ab-4273-a84e-9066c8c81fac']",7,['69d4f8a4-a9a1-41b2-b50b-8220a8fb99df'],1
3f86c786-d9ac-4887-a0be-94b36542b608,A multiscale pathway paradigm for pain characterization,[],[],[],[],[],"['5b420256-82a4-44da-b7bd-e3ad53a5450c', 'ad372efe-c342-406e-85da-aaa651d3edf4']",2,[],1
4e1b5b35-47da-43f1-910c-7deb0dcca31f,Development and Assessment of iSTEM Competencies,[],[],[],[],[],"['4e46dd2a-7dfe-4207-82ba-c042fb199f8f', '8a818f6a-be91-4c27-bdc3-164d4de8d025', '2d06919f-7d25-411a-8bf2-8f53bee1341c']",4,[],1
625e785e-ec6b-4084-9182-54b81077a843,Adaptive sliding mode control with non-integer order reference function,[],[],[],[],[],"['5b420256-82a4-44da-b7bd-e3ad53a5450c', '0496a59e-7990-494c-8d19-fa78cc900501', 'ad372efe-c342-406e-85da-aaa651d3edf4', 'b727e461-0720-421f-a47e-f8964e27b66d']",5,[],1
