ID,Name,Disciplines,WoS ID,Disciplines WoS,vabb ID,Disciplines vabb,Persons,Size,Alias,when_added
64ef8d7e-3ea3-4f90-bec1-1b568d1993bf,An RDL-configurable 3D memory tier to replace on-chip SRAM,[],['000397468600056'],[],[],[],"['9ea2b92c-fa27-4e6a-9ed8-f6bfda9a22ab', '4efcd5c4-73c4-4588-82c4-6cabc211409a', '8a818f6a-be91-4c27-bdc3-164d4de8d025']",4,[],1
c33fa22a-285c-4f6b-9e25-29f0f4a097bb,Temperature- and Supply Voltage-Independent Time References for Wireless Sensor Networks Preface,[],['000364510600001'],[],[],[],"['3f966f43-085b-4081-8bbf-e0fb7631a56d', 'dbf87248-14ca-485f-a513-cdcb850f334a', '8a818f6a-be91-4c27-bdc3-164d4de8d025']",3,[],1
6adab58d-fac6-4811-b8a7-7d27ac2b7323,"Low-cost, Polymer-based, High Aspect Ratio, Hollow Microneedles for Transdermal Drug Delivery and Blood Extraction",[],[],[],[],[],"['ecf400bd-b757-4a60-a324-366bcce73153', '9866188c-b023-4d4c-a5da-f21be6d8cb89', '3de3d3eb-d3ff-4a5d-94f8-61f55e13cc4b']",5,[],1
1016aadc-1336-461c-9f01-b1f030b7905b,"A 40nm, high bandwidth, VCO-based burst-mode receiver backend for EHF multi-carrier wireless",[],['000330857500038'],[],[],[],"['ae916ffa-ff1f-4b9c-88b8-24065ff79505', '8a818f6a-be91-4c27-bdc3-164d4de8d025']",2,[],1
0c330e09-f202-4066-8c1b-51f74ad9e0ef,Massive MIMO Processing at the Semiconductors Edge: Exploiting the System and Circuit Margins for Power Savings,[],['000414286203128'],[],[],[],"['f9f984bb-b8a3-4bc3-acc0-a2a83209a44b', '8a818f6a-be91-4c27-bdc3-164d4de8d025', 'ab12b556-ebc6-4f9a-bdc6-e1c485b14de0']",5,[],1
619d56ce-2cde-4837-adad-ebf030ff73b3,Structural and functional changes occuring during growth of the respiratory system can be quantified and classified,[],[],[],[],[],"['5b420256-82a4-44da-b7bd-e3ad53a5450c', 'ad372efe-c342-406e-85da-aaa651d3edf4', '0496a59e-7990-494c-8d19-fa78cc900501', 'b727e461-0720-421f-a47e-f8964e27b66d']",6,[],1
4901c407-8afa-47a6-89b6-d862225e368f,Minimization of Ionic Transport Resistance in Porous Monoliths for Application in Integrated Solar Water Splitting Devices,[],[],[],[],[],"['1bb7b8ee-fede-4f50-b8ec-b23818931a17', '0c901f84-9f14-4957-bf5e-1263088871bd', '7afafdf5-0fe1-49ba-9dff-1d700b7e30e5', 'ecf400bd-b757-4a60-a324-366bcce73153', '3de3d3eb-d3ff-4a5d-94f8-61f55e13cc4b', 'a37d86f0-4b8f-41db-b486-44cca61fadd4']",7,[],1
d8341158-5a0c-43ca-9d24-7bc3116b4470,Automatic tuning of predictive control in a hydrostatic drive train system in nominal operation,[],['000590181100132'],[],[],[],"['5b420256-82a4-44da-b7bd-e3ad53a5450c', '1a57f92d-23f1-4e88-a8a8-0ca992e03555', 'fc72a2bd-bbd9-4c81-9c1e-96c72ea9a8e8']",7,[],1
b23ea60e-faf5-41b4-a63b-a042aadc30a3,ERROR,ERROR,ERROR,ERROR,ERROR,ERROR,ERROR,ERROR,ERROR,1
0f3d1794-55bd-4a3b-97b0-4ef4c4cd9fe7,Vapor-Phase Deposition and Modification of Metal-Organic Frameworks: State-of-the-Art and Future Directions,['/'],['000384698500002'],['/'],[],[],"['d136cb03-c12d-41fb-89a8-90b00025cbb0', '1979eabb-80ab-4273-a84e-9066c8c81fac', '59416db9-5d0c-463d-a025-871b1d1be1f1']",3,[],1
38d8da67-0e3b-4318-94cc-3f206aa78267,Measuring nonlinear effects in respiratory mechanics: a proof of concept for prototype device and method,"['0202', '0103']",['000328692600014'],"['0202', '0103']",[],[],"['5b420256-82a4-44da-b7bd-e3ad53a5450c', 'b727e461-0720-421f-a47e-f8964e27b66d']",5,"['fca728a7-dfbe-41eb-ac6d-09c7eee25c53', '5c9df89e-fedf-44ca-8945-77f3a6795330']",1
461dbafb-68d8-4c58-a6cc-d06877610639,Vapor-deposited zeolitic imidazolate frameworks as gap-filling ultra-low-k dielectrics,[],['000481606500009'],[],[],[],"['b1254aaf-0f54-40f4-bdcc-65f4cbdbe217', 'd136cb03-c12d-41fb-89a8-90b00025cbb0', '741b5a21-5904-4b29-a627-50c7249dd776', 'b00e781b-c833-4858-9d4f-fa61c44e921d', '00ceab36-8ec2-49a5-80ca-6ed0202abcc6', '814d7511-bc92-457a-8167-7efcc323464f', '59416db9-5d0c-463d-a025-871b1d1be1f1']",9,[],1
73b4c889-b51f-42bc-b0b1-8fc236283151,Tunable hydrogel microlens with built-in polymer waveguide and fiber clamp for MEMS applications,[],[],[],[],[],"['3851e5a8-25c4-494e-9be0-aa5b82e4b59a', 'ecf400bd-b757-4a60-a324-366bcce73153', '3de3d3eb-d3ff-4a5d-94f8-61f55e13cc4b']",3,[],1
146dc2ab-8b4e-4561-930a-3f6ab1b58b7e,Impact of Interconnect Multiple-Patterning Variability on SRAMs,[],[],[],[],[],"['91a4d733-79a5-4fec-af25-11dc66ed5b86', '8a818f6a-be91-4c27-bdc3-164d4de8d025']",9,[],1
ef97076c-d2e9-4c9a-a7ed-bbc9b4f670d8,Evaluation of constrained multivariable EPSAC predictive control methodologies,[],['000332509700087'],[],[],[],"['5b420256-82a4-44da-b7bd-e3ad53a5450c', 'b727e461-0720-421f-a47e-f8964e27b66d']",4,['8b236f12-946e-473c-a482-8ac7e27dfc4d'],1
600e37f8-adcf-45c1-9eef-026f96ddf6e6,ERROR,ERROR,ERROR,ERROR,ERROR,ERROR,ERROR,ERROR,ERROR,1
9362d9c0-5710-4978-aa5e-039d2ee320fa,Bridging the Gap between Secondary and Higher STEM Education – the Case of STEM&#64;school,[],['000548251400007'],[],[],[],"['0171d5b7-3f9b-4986-a8b5-a53a08ae5a11', '293d0e08-4897-40d0-9ba8-1b493eb88230', '2d06919f-7d25-411a-8bf2-8f53bee1341c', '4e46dd2a-7dfe-4207-82ba-c042fb199f8f', '65ccccad-955a-453d-8f39-b09a32e62212', '8a818f6a-be91-4c27-bdc3-164d4de8d025']",14,[],1
f7f29d94-cf7b-4c68-b6e6-51441f5d9b0c,Architectural Design,[],['000364815700005'],[],[],[],['8a818f6a-be91-4c27-bdc3-164d4de8d025'],2,[],1
0fa34350-f4e4-4e32-a761-d4a871307a35,Models for nociception stimulation and memory effects in awake and aware healthy individuals,['0306'],['000459497300014'],['0306'],[],[],"['ad372efe-c342-406e-85da-aaa651d3edf4', '5b420256-82a4-44da-b7bd-e3ad53a5450c']",2,[],1
a29feffe-7fe1-495f-985b-942e88bc4411,Testing the MATLAB®Simulink-based frequency response analyser,[],[],[],[],[],"['b727e461-0720-421f-a47e-f8964e27b66d', '5b420256-82a4-44da-b7bd-e3ad53a5450c']",3,[],1
07f5aa2e-737e-4e0d-a252-01bd3d72a483,"A 40nm-CMOS, 18 uW, temperature and supply voltage independent sensor interface for RFID tags",[],['000330857500029'],[],[],[],"['3f966f43-085b-4081-8bbf-e0fb7631a56d', 'dbf87248-14ca-485f-a513-cdcb850f334a', '8a818f6a-be91-4c27-bdc3-164d4de8d025']",3,[],1
2011ee35-71b6-471e-ab05-a2819baec997,ERROR,ERROR,ERROR,ERROR,ERROR,ERROR,ERROR,ERROR,ERROR,1
2e1dc99f-f619-4d5f-ac4d-92ef1201a5e7,Identification and control of a miniature rotorcraft Unmanned Aerial Vehicle (UAV),[],[],[],[],[],"['b727e461-0720-421f-a47e-f8964e27b66d', '5b420256-82a4-44da-b7bd-e3ad53a5450c']",5,[],1
fbae36a2-818e-4d83-a819-55b555714d54,A 16.07pJ/cycle 31MHz Fully Differential Transmission Gate Logic ARM Cortex M0 core in 40nm CMOS,[],['000386656300062'],[],[],[],"['0b5c20fe-abbf-4870-968e-1419dbb9e674', '8a818f6a-be91-4c27-bdc3-164d4de8d025']",2,[],1
bce10b77-3def-4fce-8b85-97ea33a7f302,SRAM enablement beyond N7: a BTI study,[],['000416068500101'],[],[],[],"['649f822a-db17-4f39-9b5b-2bd76c277441', '8a818f6a-be91-4c27-bdc3-164d4de8d025']",12,[],1
40eba3fb-94ed-4bc6-9ce8-24f7540cf5d8,A pre-university outreach activity on human-computer interfaces,[],[],[],[],[],"['a7c4b54c-a880-4488-90fb-adf1be975d93', '7464b2ac-3ff2-4221-bb2b-c8ae383301f9', '457efd1d-a6ae-4d5e-9eb0-a031200f4e08', 'dbf87248-14ca-485f-a513-cdcb850f334a', '3de3d3eb-d3ff-4a5d-94f8-61f55e13cc4b', '7e030a55-9c17-4966-8d80-f3e152366f6e', '8a818f6a-be91-4c27-bdc3-164d4de8d025']",10,[],1
2d02cc99-a448-461f-b451-01720623860a,All-digital differential VCO-based A/D conversion,[],['000287216001082'],[],[],[],"['2332e091-2bbf-46e3-9521-382cb51790d7', '8a818f6a-be91-4c27-bdc3-164d4de8d025', '292ae587-7550-4243-a083-fac7a0125c69']",3,[],1
8ea6f79d-0a89-465d-9c3a-0f9ed0da8174,Sense amplifier offset voltage analysis for both time-zero and time-dependent variability,"['0202', '0103']",['000496833600006'],"['0202', '0103']",[],[],"['4efcd5c4-73c4-4588-82c4-6cabc211409a', '8a818f6a-be91-4c27-bdc3-164d4de8d025']",9,[],1
65c843d7-ff12-4b3f-8e1e-648f12f4e779,An amino-modified Zr-terephthalate metal-organic framework as an acid-base catalyst for cross-aldol condensation,['/'],['000286389500037'],['/'],[],[],"['23a9eb21-3d22-419e-a005-193572d08ad1', '59416db9-5d0c-463d-a025-871b1d1be1f1', '1979eabb-80ab-4273-a84e-9066c8c81fac']",5,[],1
1171f791-5e24-40eb-9e68-1c4f66511af7,Kritisch denken : de ethische dimensie,[],[],[],['c:vabb:281692'],[],"['b2708d1b-b295-4bb6-8157-643af8d506f5', 'dc6635a5-56db-498e-8818-58a5d70c4016', 'b9df6c37-57e1-4a21-8626-a0fb172fb55e']",4,[],1
a9d2950e-8a8f-4673-8121-bd22f4640b06,ERROR,ERROR,ERROR,ERROR,ERROR,ERROR,ERROR,ERROR,ERROR,1
46f0a1ef-2287-418f-a531-07a609aa1fad,Solid-phase microextraction coatings based on the metal-organic framework ZIF-8: Ensuring stable and reusable fibersmework MAF-6.,[],['000528209200025'],[],[],[],"['b00e781b-c833-4858-9d4f-fa61c44e921d', '59416db9-5d0c-463d-a025-871b1d1be1f1']",9,[],1
7286d646-fe80-4f5c-aa22-90bc70cf3aab,Irreducible incoherence and intelligent design : a look into the conceptual toolbox of a pseudoscience,"['0106', '0499', '0106']",['000285039800004'],['0106'],['c:vabb:299774'],"['0499', '0106']","['b2708d1b-b295-4bb6-8157-643af8d506f5', 'dc6635a5-56db-498e-8818-58a5d70c4016']",3,[],1
70034a33-e3fd-4315-83f6-d7a3956b4a06,Anesthesiologist in the loop and predictive algorithm to maintain hypnosis while mimicking surgical disturbance,[],['000423965400034'],[],[],[],"['5b420256-82a4-44da-b7bd-e3ad53a5450c', 'ad372efe-c342-406e-85da-aaa651d3edf4', 'b727e461-0720-421f-a47e-f8964e27b66d']",3,[],1
9e6aabe7-8b4f-431d-b1ba-b094ac6abd94,"A 128b organic RFID transponder chip, including Manchester encoding and ALOHA anti-collision protocol, operating with a data rate of 1529b/s",[],[],[],[],[],"['97acd216-4bca-4f77-8404-bbd849f276cf', 'f0c3f9c7-d78c-4c90-b9cc-f08c5f4c00a4', '8a818f6a-be91-4c27-bdc3-164d4de8d025', 'cd55b156-a6d8-4030-9ca0-5787f43728cd']",7,[],1
c4be54b4-3a4a-43cb-8973-f2d0557152f5,A novel DRAM architecture as a low leakage alternative for SRAM caches in a 3D interconnect context,[],['000273246700167'],[],[],[],"['eebaf398-44c2-4168-9d33-e86a4a2c5144', 'a53aef27-4a4f-45b4-867d-0012be363189', '8a818f6a-be91-4c27-bdc3-164d4de8d025', '9ea2b92c-fa27-4e6a-9ed8-f6bfda9a22ab']",5,[],1
84b9548d-42f6-4d81-b91d-fe3c2000543c,Stress-strain properties of natural and biomimetically formed collagen constructs,[],[],[],[],[],['5b420256-82a4-44da-b7bd-e3ad53a5450c'],2,[],1
6428e07f-e3d7-4f28-a9ab-395cf13d636c,Neuronal Patterns in the Cavity Wall of Lesions during Gait Cycle in a Rat Model of Brain Lesion Cavities,[],[],[],[],[],"['371d1dbb-8090-44d2-8457-a9a8c4f58e52', '489d6214-ca35-49c2-a07e-fc6d7974a6bb', 'ecf400bd-b757-4a60-a324-366bcce73153', '42abe7a5-08f8-408b-bb6a-5734cd48c0ef', '3de3d3eb-d3ff-4a5d-94f8-61f55e13cc4b', 'cfbf7e40-c765-4503-9c8c-e13acd16a0a7', '710ab832-e9f4-40f8-99a3-9b0b300a1327']",7,[],1
c536e422-1978-423e-8e67-b435090f4ad7,A PET brain reporter gene system based on type 2 cannabinoid receptors,['0306'],['000292297900016'],['0306'],[],[],"['ffccaf9d-dcd8-4c16-a2a4-419fcabf72bb', '6e7cbd03-18ef-4cf0-8b90-3c0b10fa1b52', 'b56b779a-64e0-4f62-999c-6a7816ba2050', '100d69f3-58f7-49db-aca0-f3194f3b075f', '444f4150-f221-4d88-904c-85432b9e4196', '5be4f4a9-8e23-4b68-b065-b72cf2d797c2', 'e66b4c72-61f9-42dd-8224-a5b2660dae44', 'b832bd19-044f-43d5-a0eb-cf34336427a4', '400cdfb1-243a-4a48-9da7-ea5296d057ce', 'a5f73b08-789b-436f-a5dd-de5780a46790', '1aae6a48-5264-464f-a51d-9e4ee2bb34c5']",15,[],1
5ce8a0b8-3117-496e-a725-28b15b898a4d,Selectivity for three-dimensional contours and surfaces in the anterior intraparietal area,"['0501', '0306']",['000299319900025'],"['0501', '0306']",[],[],"['40c0a2e7-a74f-4f1e-b08b-4fd7f703b659', 'e3f5e4ca-0bff-4788-8e6b-d7b9c6c958c2', '29b98789-3ec6-4b63-8e29-4b90e73d65f9', '5be4f4a9-8e23-4b68-b065-b72cf2d797c2']",5,[],1
eb138df3-ec85-4ac5-8d61-39dd5556b016,From viscoelastic models to lung function devices,[],['000402634702071'],[],[],[],['5b420256-82a4-44da-b7bd-e3ad53a5450c'],1,[],1
fea25300-d799-4773-bdef-a370e00fb4b5,"A Thin-Film, a-IGZO, 128b SRAM and LPROM Matrix With Integrated Periphery on Flexible Foil",['0202'],['000413941800023'],['0202'],[],[],"['8d201822-cb7d-4944-a6cc-07bc9fe5d905', '97acd216-4bca-4f77-8404-bbd849f276cf', 'f0c3f9c7-d78c-4c90-b9cc-f08c5f4c00a4', '8a818f6a-be91-4c27-bdc3-164d4de8d025']",8,[],1
1b7d60f0-8607-410a-a4be-1f71d35b549e,A 0.02mm2 65nm CMOS 30MHz BW all-digital differential VCO-based ADC with 64dB SNDR,[],['000287508300060'],[],[],[],"['2332e091-2bbf-46e3-9521-382cb51790d7', '8a818f6a-be91-4c27-bdc3-164d4de8d025', '292ae587-7550-4243-a083-fac7a0125c69']",4,[],1
cc657be5-7593-40c1-a707-1a57519ceeb0,A gain-scheduled PID controller for propofol dosing in anesthesia,[],[],[],[],[],['5b420256-82a4-44da-b7bd-e3ad53a5450c'],6,[],1
3778261b-4a3c-4e99-9be8-bc30497ebeaf,A 40nm CMOS Receiver for 60GHz Discrete-Carrier Indoor Localization Achieving mm-Precision at 4m Range,[],['000353615000139'],[],[],[],"['ae916ffa-ff1f-4b9c-88b8-24065ff79505', '552c087f-5c88-4b7b-a2e4-63d7ac370ff9', '74061a71-2cf9-489c-bb15-b32df5fa9d41', '2a86037c-279b-4632-acf1-fcf1561c1b59', '3f2f2060-1d9b-42c8-ad64-a94db5598223', '8a818f6a-be91-4c27-bdc3-164d4de8d025']",6,[],1
14bf45d8-610b-4e1b-b145-bfc5568a17aa,Impact of DSA process variability on circuit performance,[],[],[],[],[],"['91a4d733-79a5-4fec-af25-11dc66ed5b86', 'bccb277f-fda0-444f-b571-a914fe0b5a86', '8a818f6a-be91-4c27-bdc3-164d4de8d025']",9,[],1
5b8ec135-b36a-43ef-aa6e-67de11a42011,ERROR,ERROR,ERROR,ERROR,ERROR,ERROR,ERROR,ERROR,ERROR,1
d273db65-528b-4ef0-934c-ee6e892c7062,ERROR,ERROR,ERROR,ERROR,ERROR,ERROR,ERROR,ERROR,ERROR,1
c4be54b4-3a4a-43cb-8973-f2d0557152f5,A novel DRAM architecture as a low leakage alternative for SRAM caches in a 3D interconnect context,[],['000273246700167'],[],[],[],"['eebaf398-44c2-4168-9d33-e86a4a2c5144', 'a53aef27-4a4f-45b4-867d-0012be363189', '8a818f6a-be91-4c27-bdc3-164d4de8d025', '9ea2b92c-fa27-4e6a-9ed8-f6bfda9a22ab']",5,[],1
619d56ce-2cde-4837-adad-ebf030ff73b3,Structural and functional changes occuring during growth of the respiratory system can be quantified and classified,[],[],[],[],[],"['5b420256-82a4-44da-b7bd-e3ad53a5450c', 'ad372efe-c342-406e-85da-aaa651d3edf4', '0496a59e-7990-494c-8d19-fa78cc900501', 'b727e461-0720-421f-a47e-f8964e27b66d']",6,[],1
296f561e-4711-46ae-96d9-8b4c873d3d9c,Temperature- and Supply Voltage-Independent Time References for Wireless Sensor Networks,[],['000364510600019'],[],[],[],"['dbf87248-14ca-485f-a513-cdcb850f334a', '8a818f6a-be91-4c27-bdc3-164d4de8d025']",3,[],1
e3ea69b8-078f-4855-bdbd-07989d639178,"Fan-based device for non-invasive measurement of respiratory impedance: identification, calibration and analysis","['0306', '0306']",['000382417600014'],"['0306', '0306']",[],[],"['b727e461-0720-421f-a47e-f8964e27b66d', '5b420256-82a4-44da-b7bd-e3ad53a5450c']",3,"['069aa47b-2880-4408-a115-52a79b16ad46', '1ee5b781-c87a-4853-b773-de70618eba6c']",1
c1304208-5a89-4403-8d9b-f97519e6541e,Groundwater flow field distortion by monitoring wells and passive flux meters,"['0207', '0299']",['000363894200014'],"['0207', '0299']",[],[],"['e4bf12d0-2b10-4c32-949b-052112310531', '3474dfc8-5d66-43c4-b6a4-0fa8a1fcdf18', 'f06ccae9-ff40-4c2a-86f6-43d7c95e4178']",5,[],1
a9273546-d52c-437b-a15c-fe3854ccca51,Benchmark challenge : a robust fractional order control autotuner for the refrigeration systems based on vapor compression,[],['000435709300007'],[],[],[],"['b727e461-0720-421f-a47e-f8964e27b66d', 'ad372efe-c342-406e-85da-aaa651d3edf4', '5b420256-82a4-44da-b7bd-e3ad53a5450c']",5,[],1
a180bfb1-cf60-4fe7-84c6-b75af40508e3,Power saving through state retention in IGZO-TFT AMOLED displays for wearable applications,[],[],[],[],[],"['8d201822-cb7d-4944-a6cc-07bc9fe5d905', '8a818f6a-be91-4c27-bdc3-164d4de8d025', 'f0c3f9c7-d78c-4c90-b9cc-f08c5f4c00a4', 'cd55b156-a6d8-4030-9ca0-5787f43728cd']",21,[],1
6ed5ee55-2b79-4160-a4e1-20218f5c3e73,ERROR,ERROR,ERROR,ERROR,ERROR,ERROR,ERROR,ERROR,ERROR,1
8187a437-3863-4dda-b71c-77fd1145f6df,ERROR,ERROR,ERROR,ERROR,ERROR,ERROR,ERROR,ERROR,ERROR,1
e6927111-4100-4da6-ab13-008342f75c8a,An alternative method for measuring human respiratory impedance,[],['000320663300017'],[],[],[],"['b727e461-0720-421f-a47e-f8964e27b66d', '5b420256-82a4-44da-b7bd-e3ad53a5450c']",6,['3a48f0bd-0dd1-4abc-af02-853fa40102a8'],1
707a8641-5173-47a6-9332-6e243c382c88,Picosecond pulse generation with nonlinear transmission lines in 90-nm CMOS for mm-wave imaging applications,[],['000392711800220'],[],[],[],"['a5953171-e124-418a-9390-d00da5c0d79d', '8a818f6a-be91-4c27-bdc3-164d4de8d025', '3f2f2060-1d9b-42c8-ad64-a94db5598223']",4,[],1
1112cc62-50a5-483f-9c81-8b2159c896aa,ERROR,ERROR,ERROR,ERROR,ERROR,ERROR,ERROR,ERROR,ERROR,1
b3da6247-1bf8-4f59-8040-431eeea13835,Circuits and systems engineering education through interdisciplinary team-based design projects,[],['000297265301104'],[],[],[],"['8a818f6a-be91-4c27-bdc3-164d4de8d025', 'dbf87248-14ca-485f-a513-cdcb850f334a', '457efd1d-a6ae-4d5e-9eb0-a031200f4e08', '204c07d5-fe81-41f1-88de-d2c9d7c5ef1d', '6aaad620-7679-46e2-bbac-6ef7100b9a5f', '2d2d522c-e149-42cf-87c8-7710b40203d9', '9866188c-b023-4d4c-a5da-f21be6d8cb89', '2f8dd8a6-dcff-42ef-8537-3c75a1da7d83']",8,[],1
b7f3fd19-85eb-464a-828f-b3f0aa97e31a,A sub 10 pJ/cycle over a 2 to 200 MHz Performance Range RISC-V Microprocessor in 28 nm FDSOI,[],['000448159800085'],[],[],[],"['cef3f17a-e816-4a5c-aeef-fc5ca78350ea', '8a818f6a-be91-4c27-bdc3-164d4de8d025']",2,[],1
2570782c-8474-4686-a168-7ebbd03b8334,ERROR,ERROR,ERROR,ERROR,ERROR,ERROR,ERROR,ERROR,ERROR,1
245061e9-1db2-44e9-9cab-288888967933,Model-free Adaptive Control in Frequency Domain: application to Mechanical Ventilation,[],[],[],[],[],"['5b420256-82a4-44da-b7bd-e3ad53a5450c', 'b727e461-0720-421f-a47e-f8964e27b66d']",2,[],1
c072c6fd-548c-4468-9226-f213121cfeca,Estimation of patient sensitivity to drug effect during Propofol hypnosis,[],['000368940202101'],[],[],[],"['b727e461-0720-421f-a47e-f8964e27b66d', 'ad372efe-c342-406e-85da-aaa651d3edf4', '5b420256-82a4-44da-b7bd-e3ad53a5450c']",3,[],1
45360e1b-6c58-47db-9575-944088631758,Virginie Loveling (1836-1923) as a cultural mediator: from translating Klaus Groth to manipulating Charles Darwin,[],[],[],['c:vabb:280300'],[],"['3cd22fb2-747b-4940-9e99-f322cda4beee', '31706b13-12de-493c-8383-f094ece6ef01', 'dc6635a5-56db-498e-8818-58a5d70c4016']",5,[],1
ca32db72-7b61-499d-b303-71693fd7904a,ERROR,ERROR,ERROR,ERROR,ERROR,ERROR,ERROR,ERROR,ERROR,1
13b48354-2a40-4295-bbfe-bf86c11d1e00,ERROR,ERROR,ERROR,ERROR,ERROR,ERROR,ERROR,ERROR,ERROR,1
e3df19a2-bf02-4025-b413-bd1923b88bfb,Modelling and identification of a coupled sextuple water tank system,[],['000390997900065'],[],[],[],"['5b420256-82a4-44da-b7bd-e3ad53a5450c', 'b727e461-0720-421f-a47e-f8964e27b66d']",3,[],1
c87f6188-d0cb-4486-8b10-8e5d4b89b2c9,Measuring and analysing nonlinearities in the Lung tissue,[],[],[],[],[],['5b420256-82a4-44da-b7bd-e3ad53a5450c'],4,[],1
b281599a-6b9e-40c1-bbaf-9bb73ee1cc86,"A high speed, low voltage to high voltage level shifter in standard 1.2 V 0.13 mu m CMOS","['0501', '0202']",['000254431400009'],"['0501', '0202']",[],[],"['292ae587-7550-4243-a083-fac7a0125c69', '8a818f6a-be91-4c27-bdc3-164d4de8d025']",3,[],1
267e7a98-91a5-421a-b310-8da7afdbb1e0,Towards a multivariable model for controlling the depth of anaesthesia using Propofol and Remifentanil,[],[],[],[],[],"['5b420256-82a4-44da-b7bd-e3ad53a5450c', 'b727e461-0720-421f-a47e-f8964e27b66d']",3,[],1
6abfe1e5-9f82-4035-aca4-45f698eeef9c,Effector specificity in macaque frontal and parietal cortex,"['0501', '0306']",['000350738800016'],['0501'],['c:vabb:407178'],['0306'],"['1fef5c44-01bb-4132-a232-dc88a6028f52', '5be4f4a9-8e23-4b68-b065-b72cf2d797c2', '23063cda-f4ff-4b1c-9b16-2fa636a4dbf2']",3,[],1
d0f3d7c2-886b-4386-99c6-3d914d6f3d2f,How convenient! The epistemic rationale of self-validating belief systems,"['0603', '0501', '060302']",['000303013000003'],"['0603', '0501']",['c:vabb:322238'],['060302'],"['b2708d1b-b295-4bb6-8157-643af8d506f5', 'dc6635a5-56db-498e-8818-58a5d70c4016']",2,[],1
eeab4868-3ee0-4974-bcaf-a9d76566ca8c,The next generation of relay-based PID Autotuners (Part 1): some insights on the performance of simple relay-based PID autotuners,[],[],[],[],[],"['5b420256-82a4-44da-b7bd-e3ad53a5450c', 'b727e461-0720-421f-a47e-f8964e27b66d']",2,[],1
53d37079-00a5-46be-ad48-aa9e031317a0,Introduction to the Special Issue on the 46th European Solid-State Circuits Conference (ESSCIRC),['0202'],['000404301300001'],['0202'],[],[],['8a818f6a-be91-4c27-bdc3-164d4de8d025'],3,[],1
1953aaec-5d32-4d5e-8397-b83a575808ac,ERROR,ERROR,ERROR,ERROR,ERROR,ERROR,ERROR,ERROR,ERROR,1
4b920531-c7e4-4bbd-93b9-b99f39e5a09a,Effective Connectivity of Depth-Structure-Selective Patches in the Lateral Bank of the Macaque Intraparietal Sulcus,"['0106', '0306', '0106']",['000352080100019'],"['0106', '0306']",['c:vabb:407173'],['0106'],"['1fef5c44-01bb-4132-a232-dc88a6028f52', 'c4773c88-e4ea-4e01-a6d2-05a67d4d480f', '23063cda-f4ff-4b1c-9b16-2fa636a4dbf2', '5be4f4a9-8e23-4b68-b065-b72cf2d797c2']",5,[],1
41855138-14fe-4d59-ba3d-78df8828c27a,Towards a cyber-medical system for drug assisting devices,[],['000399400800053'],[],[],[],"['ad372efe-c342-406e-85da-aaa651d3edf4', 'b727e461-0720-421f-a47e-f8964e27b66d', '5b420256-82a4-44da-b7bd-e3ad53a5450c']",4,['da9a7ce0-ce84-40ab-8532-f38f3745e092'],1
9c59fdbc-3a94-4455-9c5b-76aa63e57427,ERROR,ERROR,ERROR,ERROR,ERROR,ERROR,ERROR,ERROR,ERROR,1
d042bc02-f031-44eb-a473-d7ee9c95009e,Templated Solvent-Free Powder Synthesis and MOF-CVD Films of the Ultramicroporous Metal–Organic Framework α-Magnesium Formate,[],['000603288800016'],[],[],[],"['0bef435a-162e-49d9-81aa-b66d5653696c', 'b00e781b-c833-4858-9d4f-fa61c44e921d', '0108619f-308b-4158-ad03-e7b593fd3387', '59416db9-5d0c-463d-a025-871b1d1be1f1']",6,[],1
46a0a3ea-befe-4c36-8b4c-d3f43fa681b2,ERROR,ERROR,ERROR,ERROR,ERROR,ERROR,ERROR,ERROR,ERROR,1
6dd79c6c-b675-44a3-9991-8ec47974c432,A fractional order impedance model to capture the structural changes in lungs,[],['000391107600382'],[],[],[],"['5b420256-82a4-44da-b7bd-e3ad53a5450c', 'ad372efe-c342-406e-85da-aaa651d3edf4', 'b727e461-0720-421f-a47e-f8964e27b66d']",3,['3852d7c5-3ed1-4b9b-bc3d-36b3eece4aa6'],1
30f2805e-5c18-4261-8eb0-e7f415cbff56,International conference on fractional signals and systems,[],[],[],[],[],"['5b420256-82a4-44da-b7bd-e3ad53a5450c', 'ad372efe-c342-406e-85da-aaa651d3edf4', '0496a59e-7990-494c-8d19-fa78cc900501', 'b727e461-0720-421f-a47e-f8964e27b66d']",7,[],1
96eb07ca-4a99-4644-beae-73cfb867ced7,Extending dynamic range of RF PWM transmitters,['0202'],['000318548000035'],['0202'],[],[],"['a9458354-9776-4acb-a405-4fd8e18aa9c9', '2316ecc6-e537-4f44-9a7d-0c5bac3dffb4', '8a818f6a-be91-4c27-bdc3-164d4de8d025', '3f2f2060-1d9b-42c8-ad64-a94db5598223']",4,[],1
c32dce80-7a22-4745-9db2-0deb4adba414,Leakage current mechanisms and estimation in memories and logic,[],[],[],[],[],['8a818f6a-be91-4c27-bdc3-164d4de8d025'],4,[],1
dfc144c5-64ad-4a1e-84a3-7fce606fd9cb,"A Low Power, Reconfigurable IR-UWB System",[],['000259505002198'],[],[],[],"['2a86037c-279b-4632-acf1-fcf1561c1b59', 'f0f9ce45-198f-4a5e-b9f4-849891ed668d', '8a818f6a-be91-4c27-bdc3-164d4de8d025']",4,[],1
1d2f96b8-1a6d-4f90-a3d6-a55a81de1d8c,Leakage control in SoCs,[],[],[],[],[],['8a818f6a-be91-4c27-bdc3-164d4de8d025'],4,[],1
b113c6a3-cb55-431a-8243-140044784eae,On fractional time derivatives in constitutive modeling of materials,[],[],[],[],[],['5b420256-82a4-44da-b7bd-e3ad53a5450c'],7,[],1
5689c58b-106b-4b3f-9e81-ee116afb5bf1,Photopatterning of fluorescent host-guest carriers through pore activation of metal-organic framework single crystals,['/'],['000404605000008'],['/'],[],[],"['d136cb03-c12d-41fb-89a8-90b00025cbb0', 'cecbc370-d5df-498f-9ab8-0139d3667f31', '1979eabb-80ab-4273-a84e-9066c8c81fac', '6d4c1ebd-139a-4917-bcea-76a7f3002aaf', '59416db9-5d0c-463d-a025-871b1d1be1f1']",7,[],1
64ef8d7e-3ea3-4f90-bec1-1b568d1993bf,An RDL-configurable 3D memory tier to replace on-chip SRAM,[],['000397468600056'],[],[],[],"['9ea2b92c-fa27-4e6a-9ed8-f6bfda9a22ab', '4efcd5c4-73c4-4588-82c4-6cabc211409a', '8a818f6a-be91-4c27-bdc3-164d4de8d025']",4,[],1
4adc3f04-7d0b-4833-b6c0-1155e161e2b7,ERROR,ERROR,ERROR,ERROR,ERROR,ERROR,ERROR,ERROR,ERROR,1
6335c3c2-d3e3-4a21-96bf-d2a950f69729,ERROR,ERROR,ERROR,ERROR,ERROR,ERROR,ERROR,ERROR,ERROR,1
792b6bb2-09a6-423b-894f-42455fc2cc15,Design and implementation of a real-time autonomous navigation system applied to lego robots,[],['000435709300059'],[],[],[],['5b420256-82a4-44da-b7bd-e3ad53a5450c'],3,['62b5b1a6-468e-4efc-b58b-039034d3590a'],1
d1f75df0-482c-454f-aacb-9089b1796c1f,Inferotemporal cortex subserves three-dimensional structure categorization,['0501'],['000299446800016'],['0501'],[],[],"['5ecdb532-de54-4307-afe4-680ab0c60770', '7f8b8f08-e99b-4e17-83f1-5b5d60791a53', '5be4f4a9-8e23-4b68-b065-b72cf2d797c2']",3,[],1
2244fbc9-5b81-4ad1-a68e-b788bf11f461,Improving the Analytical Performance of a Digital Lab-On-A-Chip for Detection and Quantification of Ig-E,[],[],[],[],[],"['b0b7d43a-fc65-4846-b343-6f06d3addece', '7bfe3c21-1cad-4fad-bcd5-5104f13b72b5', '298ecef5-64b1-4e75-b34b-9cff89da3340', '5c98f21f-ed4c-47d8-86cd-ffa495052385', 'ecf400bd-b757-4a60-a324-366bcce73153', '3de3d3eb-d3ff-4a5d-94f8-61f55e13cc4b', 'c62c10dd-df31-4c49-9a17-d801cd6a7ead']",7,[],1
030b3825-a868-4a06-93af-dd9f48c1a4cb,Model-based and model-free learning strategies for wet clutch control,"['0501', '0202', '0299']",['000347499900011'],"['0501', '0202', '0299']",[],[],"['5b420256-82a4-44da-b7bd-e3ad53a5450c', '2e8dfcc8-893e-418c-a3c7-578fb14fc012', 'b727e461-0720-421f-a47e-f8964e27b66d']",10,"['a07b037c-e3ed-412a-b303-f72e2ef73011', '9b00ff86-0db5-438a-85bf-1a69932c5b64', '5f7bc469-c32b-483a-b5db-f4ae12887cfd']",1
70f19f84-cdaa-4ce6-bda7-2e3f005eba0f,Absolute fiber-optic pressure sensing for high-temperature applications using white light interferometry,[],[],[],[],[],"['e095501f-c7e8-441e-89b6-a01a7d72c206', 'ecf400bd-b757-4a60-a324-366bcce73153', '3de3d3eb-d3ff-4a5d-94f8-61f55e13cc4b']",3,[],1
