ID,Name,Disciplines,when_added
17cf03fe-441e-444b-87f4-62214f211431,Department of Applied analytical and physical chemistry,"['010401', '010502', '010406']",1
4de38627-7da8-4cd6-8b1e-5885812ee67e,Research Group for Musculoskeletal Rehabilitation,"['030126', '030402', '030405', '030626']",1
172ee4c2-42bc-4e59-93f2-91f28a162f2a,Rehabilitation Sciences,"['030126', '030402', '030405', '030622']",1
9dda9586-d8fd-45bc-b3bc-0040511d8f50,Department of Soil Management,['010704'],1
9789e8e7-746a-46b5-8e3e-f8c5b6148e54,Mecha(tro)nic System Dynamics,['029999'],1
fd34a10e-71f6-4db9-acc0-238983fdb834,"Research Centre Accountancy, Leuven",['050201'],1
09df8bc5-bede-4232-8f5c-ece62f241fdc,"Leuven Centre for Aero & Space Science, Technology and Applications",['020301'],1
b4b0de57-795f-464c-8fb7-77ca0e391ae4,Rehabilitation Sciences & Physiotherapy,[],1
78b25da4-0f94-4607-ab73-24faf663611e,"Department of Flow, heat and combustion mechanics","['020309', '020407']",1
