ID,Name,Start,End,Disciplines,Persons,Organisations,Publications,when_added
82471ebc-0291-4304-bf0d-f416754746fb,Development of a U 43 2018sample to diagnostic reportU 43 2019 pipeline for revolutionizing diagnostics of infectious diseases in veterinary medicine ,2019-04-15Z,2020-10-14Z,['04020107'],['b6f7bd9c-7140-415f-b428-8b47a514d247'],['6cc5cf21-3993-4700-b404-266547b737cf'],[],1
561536d4-9a5a-4c11-9f74-ac7cc0b73f51,Optimizing antigen specific immunotherapy in type 1 diabetes ,2013-01-01Z,2016-12-31Z,"['030116', '030128', '030132', '030199', '030399', '030403', '030499', '030616', '030628', '030632', '030699', '039999']","['01c0fe09-cfd7-4570-b1c5-2e709738b6c7', '674a54ee-cefe-43a0-8008-4145ab0e9f5e', '7298b9cb-e762-49f5-a211-50d4d3e25cc3']","['843bb2fb-e499-4e64-b7f7-20c646bb60bd', 'f5af8a62-9241-49f1-bd56-a0aea67c9fce', '843bb2fb-e499-4e64-b7f7-20c646bb60bd']",[],1
1083e318-8105-4c0f-b89d-0be3ace2427b,FIP project Feline infectious peritonitis,2015-01-01Z,2016-12-31Z,"['030216', '010608', '030116', '010611', '030616', '030620', '030120']",['b6f7bd9c-7140-415f-b428-8b47a514d247'],['6cc5cf21-3993-4700-b404-266547b737cf'],[],1
c1553e6a-3fac-45bc-85bb-7afe3f14cd9a,Rights and duties of non state actors in international law ,2008-10-01Z,2010-04-30Z,['050502'],"['017fff71-4530-4e89-8095-b16bf36131bc', '8d991f4d-1e5d-46e7-befa-a009b746cbaa']","['612605e0-ead6-4e3e-b258-8a10285564f1', '612605e0-ead6-4e3e-b258-8a10285564f1']",[],1
d829735c-0602-415b-9c71-f6879b336dc0,PEDetect Validation of diagnostic tests for the detection and monitoring of porcine epidemic diarrhoea virus in Belgium,2015-09-01Z,2016-10-01Z,"['030216', '010611', '030620', '010608', '030120', '030616', '030116']",['b6f7bd9c-7140-415f-b428-8b47a514d247'],['6cc5cf21-3993-4700-b404-266547b737cf'],[],1
fc939bf6-db43-4e0f-903a-5cad8749a664,Regulatory Coherence and Domestic Regulatory Autonomy in an Era of International Services Markets ,2015-01-01Z,2018-12-31Z,['050502'],['8d991f4d-1e5d-46e7-befa-a009b746cbaa'],['612605e0-ead6-4e3e-b258-8a10285564f1'],[],1
fc345c06-b1fa-42b7-93fc-896636be1b54,Characteristic glycosylation patterns displayed on porcine reproductive and respiratory syndrome virus PRRSV and PRRSV infected cells and their role in interactions with sialic acid binding immune system lectins,2011-10-01Z,2014-09-30Z,"['010608', '030220', '010611', '030120', '030114', '030214', '030614', '030620', '030616', '030116', '030216']","['6472de26-7ff9-461b-84ee-e96f9f659a8c', 'b6f7bd9c-7140-415f-b428-8b47a514d247']","['6cc5cf21-3993-4700-b404-266547b737cf', '6cc5cf21-3993-4700-b404-266547b737cf']",[],1
418898d8-9843-4e39-be4d-ea18da3c93e3,Attributing responsibility A study on victim reparation by organised armed groups from an international legal perspective,2016-10-01Z,2020-12-31Z,['059999'],"['8b97c248-2582-4d7e-8739-a517f19ace1e', '35da18a9-6f60-4e37-9f04-9ba5a0267a8d', '8d991f4d-1e5d-46e7-befa-a009b746cbaa']","['1ed069ba-7bf2-4320-95ae-4985d2c5d328', '67f1fec9-585d-4d12-a178-8bc285cc8593', '612605e0-ead6-4e3e-b258-8a10285564f1']",[],1
457755b6-8313-439b-a098-dc85459b9d3e,Stratification of Obese Phenotypes to Optimize Future Obesity Therapy,2020-06-01Z,2025-05-31Z,['03010999'],"['7298b9cb-e762-49f5-a211-50d4d3e25cc3', 'b51fee7d-846b-4c81-b9ff-400202bab4f6']","['843bb2fb-e499-4e64-b7f7-20c646bb60bd', '843bb2fb-e499-4e64-b7f7-20c646bb60bd']",[],1
d1ced50b-fa0a-4bfe-8ffb-81add35b4503, How Can International Criminal Law Safeguard Fundamental Human Rights The Denial of the Rights to Fair Proceeding as International Crimes,2018-09-15Z,2022-09-15Z,['050502'],"['8d991f4d-1e5d-46e7-befa-a009b746cbaa', '520203fc-9ff0-4aba-a4b2-b6435127a0f9', '9a6016ae-9697-4855-ab07-2c3b9e2c8032']","['612605e0-ead6-4e3e-b258-8a10285564f1', 'a7cbbcca-39a3-463c-8a15-a42e6b1a3d84', 'a7cbbcca-39a3-463c-8a15-a42e6b1a3d84']",[],1
667184a0-59ac-4c37-b4b0-876bc9e2cc79,Aspects of porcine arterivirus entry in macrophages leading to virus persistence,2008-01-01Z,2008-10-01Z,"['010611', '030214', '030614', '030616', '030120', '030620', '030220', '010608', '030216', '030116', '030114']",['b6f7bd9c-7140-415f-b428-8b47a514d247'],['6cc5cf21-3993-4700-b404-266547b737cf'],[],1
57334bce-bf5d-42cf-a60b-5737bf346701,Human dignity in the case law of international courts and tribunals,2013-08-05Z,2015-08-04Z,['050502'],"['e01779f2-2960-4099-8ae7-849dd23e82be', '8d991f4d-1e5d-46e7-befa-a009b746cbaa', '624bbaa9-e259-45d5-9da4-5a925db439c1']","['da14fbf2-a049-4201-a191-70f94798cfeb', '612605e0-ead6-4e3e-b258-8a10285564f1', '67f1fec9-585d-4d12-a178-8bc285cc8593']",[],1
fdeb1226-9668-4e8b-9feb-5bf04f61e911,China and World Trade Law Are the Current Rules Fit for Addressing the Distortions Inherent in the Chinese Model of State Capitalism ,2018-04-25Z,2022-04-25Z,"['050502', '050599']","['a895ade1-c3c1-4367-8dbe-62169576bbcf', '8d991f4d-1e5d-46e7-befa-a009b746cbaa', 'e7b6e0bc-ccc1-40ff-a9aa-e97179b96335']","['da14fbf2-a049-4201-a191-70f94798cfeb', '612605e0-ead6-4e3e-b258-8a10285564f1', '612605e0-ead6-4e3e-b258-8a10285564f1']",[],1
2bdcf88e-52d2-4c9f-9091-8336a28a9137,Single cell RNA and small non coding RNA sequencing to identify biomarkers for pathogenesis and therapy response in type 1 diabetes ,2018-11-19Z,2022-11-19Z,"['030109', '030609']","['01c0fe09-cfd7-4570-b1c5-2e709738b6c7', '7298b9cb-e762-49f5-a211-50d4d3e25cc3', '1abf0960-b9b3-4d67-90d9-4e4feb3c4d98']","['843bb2fb-e499-4e64-b7f7-20c646bb60bd', '843bb2fb-e499-4e64-b7f7-20c646bb60bd', '843bb2fb-e499-4e64-b7f7-20c646bb60bd']",[],1
463fd3e3-4d42-4410-831e-494705c54b0c,IOF mandate Mieke Haesen,2019-07-01Z,2022-06-30Z,"['01020702', '01020704', '01020901', '01020904', '01020906']","['eb3c636c-f1a6-4ab6-8fdd-62dbbd37a716', 'b469b826-4f05-4189-a188-b4613db3d775']","['83c49bde-1d14-45a2-8ced-36a079096e62', '83c49bde-1d14-45a2-8ced-36a079096e62']",[],1
c2e137bf-912a-4fd9-ad5d-5793f55c400c,Organization and evolution of prokaryotic transcriptional networks ,2009-01-01Z,2012-12-31Z,"['010207', '010603', '020803', '030102', '030301', '030303', '030602']","['082b880d-29ab-4399-982b-54ef1b21dacb', 'eb3d9780-db85-4532-9320-c17fbf6f52bc']","['e9519ece-fc8b-4742-9727-08b1c53d6d07', 'e9519ece-fc8b-4742-9727-08b1c53d6d07']",[],1
2dfe5bc0-6bf5-46e3-96f1-a021c08cb3a7,IOF Mandate Mieke Haesen extension,2015-01-01Z,2019-06-30Z,"['010103', '010202', '010203', '010204', '010205', '010206', '010207', '010208', '010209', '020801', '020802', '020803']","['b469b826-4f05-4189-a188-b4613db3d775', '01809df1-01f0-4361-bcda-8b763f56a4be', 'eb3c636c-f1a6-4ab6-8fdd-62dbbd37a716', '4c962a4d-ad60-43fe-8f8b-f2014d55181a']","['83c49bde-1d14-45a2-8ced-36a079096e62', '83c49bde-1d14-45a2-8ced-36a079096e62', '83c49bde-1d14-45a2-8ced-36a079096e62', '83c49bde-1d14-45a2-8ced-36a079096e62', '83c49bde-1d14-45a2-8ced-36a079096e62']",[],1
e2ca3af0-068c-43a3-8402-6cd7a3d4e0a9,Is PFKFB4 a metabolic checkpoint controlling 1 25 OH 2D3 modulated dendritic cell DC tolerogenicity ,2015-01-01Z,2017-12-31Z,"['030116', '030128', '030132', '030199', '030399', '030403', '030499', '030616', '030628', '030632', '030699', '039999']","['7298b9cb-e762-49f5-a211-50d4d3e25cc3', '01c0fe09-cfd7-4570-b1c5-2e709738b6c7']","['843bb2fb-e499-4e64-b7f7-20c646bb60bd', '843bb2fb-e499-4e64-b7f7-20c646bb60bd']",[],1
36d76f2c-e393-40dd-9f72-e10e277c806d,Pig MinION,2017-10-01Z,2020-09-30Z,"['049999', '040299', '010601', '040201']",['b6f7bd9c-7140-415f-b428-8b47a514d247'],['6cc5cf21-3993-4700-b404-266547b737cf'],[],1
75dc3689-1dbd-45d8-8605-54807b5d72d2,A Universal Mid Air Gesture Guidance System,2016-09-01Z,2017-10-31Z,"['020801', '020802', '020803']","['80fefe3d-a3e5-4756-8950-11247059491d', '01809df1-01f0-4361-bcda-8b763f56a4be', 'eb3c636c-f1a6-4ab6-8fdd-62dbbd37a716']","['83c49bde-1d14-45a2-8ced-36a079096e62', '83c49bde-1d14-45a2-8ced-36a079096e62', '83c49bde-1d14-45a2-8ced-36a079096e62']",[],1
fbb5c27a-d058-4150-8876-b55c2355b6e3,Mutable The Multi Media Multi Touch Table,2008-01-01Z,2009-12-31Z,['0101'],"['01809df1-01f0-4361-bcda-8b763f56a4be', 'b469b826-4f05-4189-a188-b4613db3d775', 'a523489d-807e-4b6e-bcd3-2bb8c4a3f1cb', 'eb3c636c-f1a6-4ab6-8fdd-62dbbd37a716', 'f032fe18-abd0-4105-b131-489550586ab5']","['83c49bde-1d14-45a2-8ced-36a079096e62', '83c49bde-1d14-45a2-8ced-36a079096e62', '83c49bde-1d14-45a2-8ced-36a079096e62', '83c49bde-1d14-45a2-8ced-36a079096e62', '83c49bde-1d14-45a2-8ced-36a079096e62']",[],1
3d84b35f-8418-4c42-b57d-abf9e378f97f,Immune responses of swine to highly virulent Chinese porcine reproductive and respiratory syndrome virus PRRSV ,2011-10-01Z,2012-10-31Z,"['030214', '010601', '030114', '049999', '030220', '030614', '040299', '040201']","['b6f7bd9c-7140-415f-b428-8b47a514d247', 'f0b86308-4922-4ce0-903b-5a555b237f38']","['6cc5cf21-3993-4700-b404-266547b737cf', '6cc5cf21-3993-4700-b404-266547b737cf']",[],1
442dd4ea-05ce-48b1-8434-4218dd74edbe,INNODIA type 1 diabetes research ,2015-11-01Z,2022-10-31Z,['010601'],['7298b9cb-e762-49f5-a211-50d4d3e25cc3'],['843bb2fb-e499-4e64-b7f7-20c646bb60bd'],[],1
343d91d0-d3a0-48bf-8232-c74df7fe1995,Entry of feline coronaviruses in their primary target cells,2010-10-01Z,2014-09-30Z,"['030216', '030616', '010611', '010608', '030620', '030120', '030116']","['cb9a33f2-9ee4-4b68-999e-887655892f50', 'b6f7bd9c-7140-415f-b428-8b47a514d247', '5e480cf2-9c1f-41e2-a242-1b7a72f36c06', '6947c7bb-e23d-4632-8e2c-6ac918b7a3d4']","['6cc5cf21-3993-4700-b404-266547b737cf', '6cc5cf21-3993-4700-b404-266547b737cf', '6cc5cf21-3993-4700-b404-266547b737cf', '0053b9e1-b5be-40f7-acc7-16b65e968727']",[],1
ae0aed7c-d3f0-4d80-bf6e-cdbbf54543c7,Strategic challenges in the EU Brazil relationship ,2012-05-07Z,2012-11-30Z,[],['8d991f4d-1e5d-46e7-befa-a009b746cbaa'],['612605e0-ead6-4e3e-b258-8a10285564f1'],[],1
88684956-dd0e-44c1-b0c6-a2fd3552afb3,Acromegaly in Belgium a multicentre clinical outcome study,2010-10-01Z,2014-09-01Z,[],['7298b9cb-e762-49f5-a211-50d4d3e25cc3'],['843bb2fb-e499-4e64-b7f7-20c646bb60bd'],[],1
6ef4020f-3fa1-4f28-b3bd-6951a5b2a706,Synthetic biology building a microbial pathway with characterized biomodules according tot electrical circuit principles ,2008-10-01Z,2014-02-18Z,[],"['eb3d9780-db85-4532-9320-c17fbf6f52bc', 'dbf87248-14ca-485f-a513-cdcb850f334a', '09447b32-8f7a-4d8f-be51-20483b847ca2', 'be29c71d-8643-465c-aae4-4ce5ba6352c5']","['e9519ece-fc8b-4742-9727-08b1c53d6d07', 'c9d4fd7e-e66b-465f-8d7e-afe4d6cef1ad', 'e9519ece-fc8b-4742-9727-08b1c53d6d07', 'e9519ece-fc8b-4742-9727-08b1c53d6d07']",[],1
93489f69-cb0a-4643-afbd-f4c3fc67b8c2,Religious toleration and peace RETOPEA ,2018-05-01Z,2022-04-30Z,"['06030401', '05030110', '05030303', '05040107', '05060213', '05080505', '06010407', '06010422', '06030410', '06040505', '06040506', '06040707']","['8d991f4d-1e5d-46e7-befa-a009b746cbaa', '4e9ce648-a2b2-4c57-92f9-fe91b2c6b5a7', '8eef1b03-c90a-4bc4-85a3-0ae5ac98f677', '0b6982d2-d5ba-465a-a56f-9faf15900c24', '7e9f3fba-af47-4edf-9e67-9ead4d4b00db', '233d423f-78a8-403c-8cd3-eb68a3f2f40d']","['612605e0-ead6-4e3e-b258-8a10285564f1', '873a99ba-1ecc-4e92-97d6-75f35509ef4e', '7d62c0ab-5a6e-45e9-8740-6a6c929356fe', '71dfc18b-6707-4cd3-96a8-f08ab660f8ed', 'ab29e1ef-f2e8-480c-a5e4-6c533bda3f4d', '686cf9b5-adbf-4046-9361-c41438aff052']",[],1
5024afae-536f-41a5-82a6-79287db37484,Internation Coordination Action on effectivness of voluntary sustainability standards for United Nations forum on sustainability standards ,2020-01-01Z,2022-12-31Z,['05050214'],['8d991f4d-1e5d-46e7-befa-a009b746cbaa'],['612605e0-ead6-4e3e-b258-8a10285564f1'],[],1
cb7124c0-a2b9-4f23-836f-aeb888013c16,The beta cell in type 1 diabetes interaction with the immune system ,2012-09-01Z,2017-02-21Z,"['030109', '030609']","['20defeaa-7bfe-4ff1-85b1-f2f9300a21fe', '0f3f2b68-23c6-4fe0-874f-db7b32c2e674', '7298b9cb-e762-49f5-a211-50d4d3e25cc3']","['843bb2fb-e499-4e64-b7f7-20c646bb60bd', '843bb2fb-e499-4e64-b7f7-20c646bb60bd', '843bb2fb-e499-4e64-b7f7-20c646bb60bd']",['c003bd35-6589-4148-bbac-d678677b650f'],1
9b7e0bfd-238a-49f3-910f-b534b7b5791f,Toward a Global Health Law Regime for Effective Global Health Governance,2016-07-25Z,2018-04-17Z,"['050502', '050599']","['8d991f4d-1e5d-46e7-befa-a009b746cbaa', 'fd61eeef-be15-4173-af9f-c289e12131fb']","['612605e0-ead6-4e3e-b258-8a10285564f1', '612605e0-ead6-4e3e-b258-8a10285564f1']",[],1
b16053bf-f4ee-449e-a363-b2797535345d,The legalization of corporate social responsibility towards a new doctrine of international legal status in a global governance context ,2011-12-20Z,2017-04-24Z,['050502'],"['8d991f4d-1e5d-46e7-befa-a009b746cbaa', 'a895ade1-c3c1-4367-8dbe-62169576bbcf', 'b58b6173-c58c-4cb3-8b86-0560b3bb6979']","['612605e0-ead6-4e3e-b258-8a10285564f1', 'da14fbf2-a049-4201-a191-70f94798cfeb', '9584090f-262f-4eef-a81c-5307d8f80be9']",['9b2c2415-cce6-490f-b9c7-463099db2771'],1
e25f768c-188c-4142-a485-5b2a22730707,Single cell RNA and small non coding RNA sequencing to identify biomarkers for pathogenesis and therapy response in type 1 diabetes ,2019-01-01Z,2022-12-31Z,"['03010902', '03011903']","['01c0fe09-cfd7-4570-b1c5-2e709738b6c7', '7298b9cb-e762-49f5-a211-50d4d3e25cc3']","['843bb2fb-e499-4e64-b7f7-20c646bb60bd', '843bb2fb-e499-4e64-b7f7-20c646bb60bd']",[],1
a7188267-c292-4b7f-9840-938320afc396,Dealing with multiple mediators in causal mediation analysis,2017-01-01Z,2019-12-31Z,"['010107', '010103']","['252e7cd9-2a46-4105-b7e4-3b3bb86f4ce2', '1592bfa9-0dfd-4a92-8f2b-6c54420fcf5a', '0e372ef9-b178-4350-b169-2b8a6a475e9b']","['3f7009cc-522d-4a7a-9a4f-e1d99123f630', '3f7009cc-522d-4a7a-9a4f-e1d99123f630', '77a340c9-7679-4f7b-99d0-8c3e366ddce7']",[],1
03ac8a94-614a-4357-91c3-359a8942f4f8,Accountability for human rights violations by international organisations ,2008-01-01Z,2011-12-31Z,['050502'],['8d991f4d-1e5d-46e7-befa-a009b746cbaa'],['612605e0-ead6-4e3e-b258-8a10285564f1'],[],1
ac81ab52-ce3b-4fc0-b530-7ff83fc2296a,Identification and comparison of prokaryote transcriptional networks ,2009-10-01Z,2009-10-19Z,[],"['728ce370-2f26-4970-883e-651e141f71ab', 'eb3d9780-db85-4532-9320-c17fbf6f52bc']","['e9519ece-fc8b-4742-9727-08b1c53d6d07', 'e9519ece-fc8b-4742-9727-08b1c53d6d07']",[],1
1a4b40c7-7ae4-44f3-b6e1-13e27bda2047,Global Governance and the European Union Future Trends and Scenarios,2019-01-01Z,2022-06-30Z,"['05050216', '05060603']",['8d991f4d-1e5d-46e7-befa-a009b746cbaa'],['612605e0-ead6-4e3e-b258-8a10285564f1'],[],1
04d8fe1f-689c-40d1-87cc-4e1615a7d182,Managing biosafety and biodiversity in a global world EU US California and comparative perspectives ,2008-01-01Z,2009-06-30Z,"['050201', '050204', '050205', '050209', '050210']","['6d476b34-08dd-4a4c-a845-be703f1e237f', '8d991f4d-1e5d-46e7-befa-a009b746cbaa']","['81087032-d03c-4748-bf9d-d43d9afe64d2', '612605e0-ead6-4e3e-b258-8a10285564f1']",[],1
3f3b7776-c44d-4104-9789-b505e00053f7,The role of E catenin in the control of bone mass and marrow adiposity Implications for systemic metabolic disorders ,2016-09-15Z,2020-12-31Z,"['030126', '030626']","['7298b9cb-e762-49f5-a211-50d4d3e25cc3', '9ade0482-d5c9-40cd-9a3c-2496720a4ebd', 'a1634040-29d8-4a7d-a275-5a8d23b6b0bc']","['843bb2fb-e499-4e64-b7f7-20c646bb60bd', '61a9f0d7-1f47-46b1-9a91-25973d85f88e', '61a9f0d7-1f47-46b1-9a91-25973d85f88e']",[],1
9f553ff4-a0f9-4afd-b297-8b092ac3f162,MapFlux Bridging the Gap Between Paper based Maps and Their Digital Counterparts,2014-01-01Z,2017-12-31Z,"['010103', '010202', '010203', '010204', '010205', '010206', '010207', '010208', '010209']","['8f67a470-84f9-4a9e-ba6c-6eafe6915db7', 'eb3c636c-f1a6-4ab6-8fdd-62dbbd37a716']","['83c49bde-1d14-45a2-8ced-36a079096e62', '83c49bde-1d14-45a2-8ced-36a079096e62']",[],1
576c13d5-4b40-4b59-adcb-d4afeb9b1a25,Live cell analysis equipment for the study of biosafety level BSL3 pathogens,2018-06-01Z,2020-05-31Z,"['04020115', '04020102', '04020111']","['bd531feb-45a6-4fbf-a0d1-e44e6b00794c', '289466bc-f129-4749-b1bb-8868858483e0', 'b6f7bd9c-7140-415f-b428-8b47a514d247']","['6cc5cf21-3993-4700-b404-266547b737cf', '2975cb25-a687-4800-8113-c924c1b5d363', '6cc5cf21-3993-4700-b404-266547b737cf']",[],1
1e658f1b-bda4-4cfa-9bb7-f194e382037a,Production of immunotolerant pigs to PCV1 and PCV2 and approach to reproduce postweaning multisystemic wasting syndrome PMWS ,2010-10-01Z,2012-09-30Z,"['030614', '030114', '030620', '030120', '030216', '010611', '030214', '030220', '010608', '030116', '030616']","['b6f7bd9c-7140-415f-b428-8b47a514d247', 'a70ec165-24ff-4783-9baa-927c64a0cc92']","['6cc5cf21-3993-4700-b404-266547b737cf', '6cc5cf21-3993-4700-b404-266547b737cf']",[],1
3deb6a5d-1952-4b0e-a3c1-7121799e648c,Development of an innovative range of antiseptics disinfectants,2012-04-01Z,2014-03-31Z,"['010611', '030116', '030216', '030616', '030620', '010608', '030120']","['808a2cb7-3b1d-4af3-a770-0451c5474038', 'b6f7bd9c-7140-415f-b428-8b47a514d247']","['42a8d1b9-6afa-4bb4-b473-6450550681ad', '6cc5cf21-3993-4700-b404-266547b737cf']",[],1
4b18f15e-3aa3-422b-aa72-c702a14e1c9e,Business and human rights a critical reflection on corporate human rights responsibility through a re interpretation of US and EU corporate law and its foundational view on the corporations role within society,2012-12-11Z,2015-06-09Z,"['050502', '050599']","['209c6df6-bbf1-4460-9092-8729b776c84c', '8d991f4d-1e5d-46e7-befa-a009b746cbaa']","['612605e0-ead6-4e3e-b258-8a10285564f1', '612605e0-ead6-4e3e-b258-8a10285564f1']",[],1
80921f23-4e34-4457-a72d-1e41f920dad5,Identification of new Salmonella biofilm inhibitors through a 39 bottom up 39 and 39 top down 39 approach ,2009-01-01Z,2013-09-12Z,"['020501', '020601', '020602', '020603', '020699', '020701', '020702', '020799', '010608', '010611', '030116', '030120', '030616', '030620']","['082b880d-29ab-4399-982b-54ef1b21dacb', '645b5404-9d03-48bd-a324-d50ce3455685', 'be29c71d-8643-465c-aae4-4ce5ba6352c5']","['e9519ece-fc8b-4742-9727-08b1c53d6d07', 'e9519ece-fc8b-4742-9727-08b1c53d6d07', 'e9519ece-fc8b-4742-9727-08b1c53d6d07']",[],1
329ba6fe-a37c-4eb4-8c84-ef873a225a18,BetaCellYherapy ,2010-01-01Z,2015-06-30Z,[],['7298b9cb-e762-49f5-a211-50d4d3e25cc3'],['843bb2fb-e499-4e64-b7f7-20c646bb60bd'],[],1
086b865f-232b-4f86-b386-f3b162b5dd29,Deliberation in the Common Interest on Mankind the role of Multilateral Forums in International Law Making for the Global Commons ,2014-09-01Z,2020-06-16Z,"['059999', '050502']","['8d991f4d-1e5d-46e7-befa-a009b746cbaa', '4ae9f117-a91c-4152-97c7-edffe9313250']","['612605e0-ead6-4e3e-b258-8a10285564f1', '612605e0-ead6-4e3e-b258-8a10285564f1']",[],1
035ac23f-2d35-46f6-aa84-b32384831049,Dynamic interaction between beta cells antigens and immune system cells in type 1 diabetes ,2009-10-01Z,2016-03-10Z,"['030109', '030609', '030114', '030614']","['674a54ee-cefe-43a0-8008-4145ab0e9f5e', '7298b9cb-e762-49f5-a211-50d4d3e25cc3']","['f5af8a62-9241-49f1-bd56-a0aea67c9fce', '843bb2fb-e499-4e64-b7f7-20c646bb60bd']",[],1
76d6c9d2-b359-4849-845f-5c983485a079,The legal framework of space reversible operations a fundamental inquiry into the interplay between space law and public international law,2018-10-08Z,2022-10-08Z,['05050214'],"['5046e3d1-1af9-42a0-b5af-67b9ebab9793', '8d991f4d-1e5d-46e7-befa-a009b746cbaa', 'bc2cdbab-d0f9-4263-8a86-d854eeaac87a']","['612605e0-ead6-4e3e-b258-8a10285564f1', '612605e0-ead6-4e3e-b258-8a10285564f1', '67f1fec9-585d-4d12-a178-8bc285cc8593']",[],1
5f86904a-3995-495a-be59-4ecefcd4e3f8,Development of customizable attenuated and vector vaccines to protect against porcine reproductive and respiratory syndrome PRRS essential for a successful treatment,2012-01-01Z,2015-12-31Z,"['030216', '030616', '030120', '030620', '010611', '010608', '030116']",['b6f7bd9c-7140-415f-b428-8b47a514d247'],['6cc5cf21-3993-4700-b404-266547b737cf'],[],1
1c3bb44c-1b5b-4ecb-8a1c-9773d88d14c7,Opportunities and pitfalls for sustainable materials management in European Union law EU materials law examined ,2012-11-01Z,2018-06-23Z,"['050502', '050599']","['a895ade1-c3c1-4367-8dbe-62169576bbcf', 'b6d7ea2c-4962-45a7-b913-8b02680ede2a', '8ed00754-b467-446d-82f5-38056dc29370']","['da14fbf2-a049-4201-a191-70f94798cfeb', '9584090f-262f-4eef-a81c-5307d8f80be9']",['a65fc48e-69e3-4251-950d-722ed26cbb45'],1
ed21779f-f31f-4122-b6a5-7381a3b7df6f,Ex Machina,2010-01-01Z,2010-12-31Z,"['0101', '0102', '0208']","['eb3c636c-f1a6-4ab6-8fdd-62dbbd37a716', '01809df1-01f0-4361-bcda-8b763f56a4be']","['83c49bde-1d14-45a2-8ced-36a079096e62', '83c49bde-1d14-45a2-8ced-36a079096e62']",[],1
6fd98e5b-7c58-44fd-91da-afba6ea6732f,Transforming human interface designs through model driven engineering,2008-01-01Z,2011-12-31Z,"['0101', '0102']","['1086a6a5-8106-48ce-96d6-4f5a3c6a41b2', 'eb3c636c-f1a6-4ab6-8fdd-62dbbd37a716', '01809df1-01f0-4361-bcda-8b763f56a4be']","['83c49bde-1d14-45a2-8ced-36a079096e62', '83c49bde-1d14-45a2-8ced-36a079096e62', '83c49bde-1d14-45a2-8ced-36a079096e62']",[],1
ecb85d38-76e5-4e18-a47c-c664ff5a0ce2,Trading the intangible in a digital world digital services under international trade law,2015-09-01Z,2019-10-05Z,['059999'],"['a895ade1-c3c1-4367-8dbe-62169576bbcf', '8d991f4d-1e5d-46e7-befa-a009b746cbaa', 'dd58eca7-6eee-45a5-8b0e-a7ba739a5264']","['da14fbf2-a049-4201-a191-70f94798cfeb', '612605e0-ead6-4e3e-b258-8a10285564f1', '67f1fec9-585d-4d12-a178-8bc285cc8593']",['65a1f6e2-acce-439c-8153-40834bcd19d7'],1
133e358b-e701-4459-a529-46105e4b7127,Price differentiation from an EU legal perspective An intradisciplinary study into the scope systemic coherence and adequacy of the regulatory framework ,2015-09-01Z,2020-01-05Z,"['050502', '050599']","['a895ade1-c3c1-4367-8dbe-62169576bbcf', '454a3846-6841-4b0c-b67b-6086e39f146d', '0b859a97-787b-4545-b938-0fa5aec0e6b3']","['da14fbf2-a049-4201-a191-70f94798cfeb', 'd28253b7-1b02-4198-afec-6d34edd7678d', 'd28253b7-1b02-4198-afec-6d34edd7678d', 'd28253b7-1b02-4198-afec-6d34edd7678d']",[],1
94285807-b63b-4fbe-895e-ad8ce8e9db89,Ritchie a center for mobile ICT applications within the heritage and cultural tourism sector ,2008-09-01Z,2010-11-30Z,['0101'],"['eb3c636c-f1a6-4ab6-8fdd-62dbbd37a716', '01809df1-01f0-4361-bcda-8b763f56a4be']","['83c49bde-1d14-45a2-8ced-36a079096e62', '83c49bde-1d14-45a2-8ced-36a079096e62']",[],1
68002f6e-15c2-4e24-9481-139dd1c64719,Explaining Global India a multi sectoral PhD training programme analysing the emergence of India as a global actor,2017-04-01Z,2021-03-31Z,['050502'],"['60772b54-f741-41e0-b516-e645c3778fcc', '8d991f4d-1e5d-46e7-befa-a009b746cbaa']","['686cf9b5-adbf-4046-9361-c41438aff052', '612605e0-ead6-4e3e-b258-8a10285564f1']",[],1
1258aebc-f57b-4d4f-91ec-d71b0c0ecbd5,Exploration of macrophage specific molecules for cell directed therapy,2010-10-01Z,2012-10-01Z,"['030120', '020799', '020601', '030614', '030214', '020699', '030220', '030114', '030116', '020603', '030620', '020701', '020501', '020602', '020702', '030216', '010608', '010611', '030616']","['b6f7bd9c-7140-415f-b428-8b47a514d247', '40de94b9-2a02-4177-ad1d-e6333f75d9a1']","['6cc5cf21-3993-4700-b404-266547b737cf', '6cc5cf21-3993-4700-b404-266547b737cf']",[],1
a74f9282-1568-41a6-a911-e4e2af6e3290,Identification and characterization of gene functions involved in synergistic interactions in a pollutant degrading multi species bacterial consortium ,2010-10-01Z,2019-02-19Z,"['020406', '020501', '020601', '020602', '020603', '020699', '020701', '020702', '020799']","['e396b91b-e0f3-410a-85a4-1bcab5d6ceb8', 'eb3d9780-db85-4532-9320-c17fbf6f52bc', '34c47e1f-48a2-4c56-981a-40d4e211465c', '274327a7-64ba-4f36-81fc-d4f90b73d084']","['e9519ece-fc8b-4742-9727-08b1c53d6d07', 'e9519ece-fc8b-4742-9727-08b1c53d6d07', '960b6e0f-81e7-49eb-9e82-c1a0423d6a51', '960b6e0f-81e7-49eb-9e82-c1a0423d6a51']",['b75f9909-b20e-4809-a6c8-41a80d8805e6'],1
19e0394f-12ca-4c46-9483-f8c3eaa9ed49,Study of the cellular protease activity in the replication cycle of the porcine reproductive and respiratory syndrome virus for the targeted development of vaccines and vaccine virus production,2011-10-01Z,2016-06-30Z,"['030616', '030620', '010608', '030120', '030116', '010611', '030216']","['ec14842d-ebe6-44c6-ab71-3a02ad8fb2c4', 'b6f7bd9c-7140-415f-b428-8b47a514d247']","['6cc5cf21-3993-4700-b404-266547b737cf', '6cc5cf21-3993-4700-b404-266547b737cf']",[],1
2ae225e6-78a9-41b5-bc31-e45a4943d05c,Deciphering the molecular pathways needed to restore monocyte dysfunction during Acute on chronic liver failure,2018-09-13Z,2022-09-13Z,"['030129', '030403', '030629', '030110', '030610', '030114', '030614']","['674a54ee-cefe-43a0-8008-4145ab0e9f5e', '43cd79ee-b5c3-4481-a1d5-f6babcf632e0', '26a1ded1-c19b-4290-8275-310b9f9d3df2', '49932137-7a35-4cda-a93e-e0ec725a2624']","['f5af8a62-9241-49f1-bd56-a0aea67c9fce', 'c1488dbe-1f72-4548-9799-32301dfedd40', 'c1488dbe-1f72-4548-9799-32301dfedd40', 'c1488dbe-1f72-4548-9799-32301dfedd40']",[],1
141960cc-f7bb-4eb0-93eb-daf586a47fa3,Bias reduced double robust estimation,2016-01-01Z,2019-12-31Z,"['010107', '010103']",['0e372ef9-b178-4350-b169-2b8a6a475e9b'],['77a340c9-7679-4f7b-99d0-8c3e366ddce7'],[],1
96d12a48-bd47-4365-847f-3d29993170b2,In search of neurophysiological markers for an auditory processing deficit in dyslexia ,2015-01-01Z,2018-12-31Z,['050502'],['8d991f4d-1e5d-46e7-befa-a009b746cbaa'],['612605e0-ead6-4e3e-b258-8a10285564f1'],[],1
8d9f60cc-c2f8-46b6-b576-62a2276cb560,Development of fast assays for the identification of SARS CoV 2 infected immune humans animals and potential human animal human transmissions,2020-04-15Z,2021-01-14Z,"['03022002', '03022007', '04020115', '03012007']","['505d734b-7819-4585-a295-9ac296d19cd0', 'b6f7bd9c-7140-415f-b428-8b47a514d247', 'ffda7952-1036-4d57-aab6-4adfcb3cc7ab']","['6cc5cf21-3993-4700-b404-266547b737cf', '6cc5cf21-3993-4700-b404-266547b737cf', '6cc5cf21-3993-4700-b404-266547b737cf']",[],1
ddc1151e-6691-4ae2-86a8-f18e768d2a75,Streetware Urban Computing Interfaces to Enhance Citizen Engagement,2013-01-01Z,2016-12-31Z,"['010103', '010202', '010203', '010204', '010205', '010206', '010207', '010208', '010209', '020801', '020802', '020803']",['eb3c636c-f1a6-4ab6-8fdd-62dbbd37a716'],['83c49bde-1d14-45a2-8ced-36a079096e62'],[],1
